,SNo.,company,amount
0,1,Cesc Ltd,"159,500,000.00"
1,2,Bandhan Bank Limited,"42,100,000.00"
2,3,Firstsource Solutions Limited,"29,300,000.00"
3,4,Srei Infrastructure Finance Limited,"23,000,000.00"
4,5,Srei Equipment Finance Limited,"21,800,000.00"
5,6,Vedant Fashions Private Limited,"20,100,000.00"
6,7,Zandu Realty Limited,"16,800,000.00"
7,8,Patton International Ltd,"12,500,000.00"
8,9,P.C.Chandra & Sons (India) Private Limited,"11,500,000.00"
9,10,Russell Credit Ltd,"11,100,000.00"
10,11,Hil Limited,"10,000,000.00"
11,12,Banik Rubber Industries (India) Private Limited,"10,000,000.00"
12,13,J G Hosiery Private Limited,"8,800,000.00"
13,14,Pricewaterhousecoopers Service Delivery Center (Kolkata) Private Limited,"8,300,000.00"
14,15,Dollar Industries Limited,"8,100,000.00"
15,16,Alkem Laboratories Limited,"8,100,000.00"
16,17,Jms Mining Services Private Limited,"7,800,000.00"
17,18,Lux Industries Limited,"7,800,000.00"
18,19,Tata Aig General Insurance Company Limited,"7,500,000.00"
19,20,Madhu Jayanti International Private Limited,"7,000,000.00"
20,21,Tmf Holdings Limited,"5,800,000.00"
21,22,La Opala R G Limited,"5,800,000.00"
22,23,Bengal Nri Complex Ltd.,"5,800,000.00"
23,24,Saregama India Limited,"5,700,000.00"
24,25,Surya Vidyut Limited,"5,500,000.00"
25,26,Adventz Finance Private Limited,"5,100,000.00"
26,27,Magma Fincorp Limited,"5,000,000.00"
27,28,Bmw Industries Limited,"5,000,000.00"
28,29,Merino Panel Products Ltd,"4,900,000.00"
29,30,Balajee Education Private Limited,"4,600,000.00"
30,31,Vikram Solar Limited,"4,600,000.00"
31,32,Crescent Power Limited,"4,600,000.00"
32,33,Second Vivekananda Bridge Tollway Company Private Limited,"4,500,000.00"
33,34,Dhunseri Tea & Industries Limited,"4,300,000.00"
34,35,Kpmg Global Services Private Limited,"4,200,000.00"
35,36,Meenakshi Mercantiles Ltd,"4,100,000.00"
36,37,Ipm Commodities Private Limited,"3,900,000.00"
37,38,Haldia Energy Limited,"3,700,000.00"
38,39,Emami Paper Mills Limited,"3,400,000.00"
39,40,Pressman Advertising Limited,"3,400,000.00"
40,41,Bma Stainless Limited,"3,400,000.00"
41,42,Experis It Private Limited,"3,300,000.00"
42,43,Albert David Ltd,"3,100,000.00"
43,44,Tarsons Products Pvtltd,"3,100,000.00"
44,45,Inland Power Limited,"3,000,000.00"
45,46,H C Commercial Ltd,"3,000,000.00"
46,47,Bajaj Finance Limited,"3,000,000.00"
47,48,Shyam Ferro Alloys Ltd.,"3,000,000.00"
48,49,Bharat Containers (Nagpur) Pvt Ltd,"2,800,000.00"
49,50,Pn Memorial Neuro Centre & Research Institute Limited,"2,700,000.00"
50,51,Joy Global (India) Limited,"2,500,000.00"
51,52,Aditya Birla Finance Limited,"2,500,000.00"
52,53,Khadim India Limited,"2,300,000.00"
53,54,Disha Eye Hospitals Private Limited,"2,200,000.00"
54,55,Ritika Private Limited,"2,000,000.00"
55,56,Dhunseri Investments Limited,"2,000,000.00"
56,57,Koppern Maco Services Private Limited,"2,000,000.00"
57,58,The Peerless General Finance & Investment Co Ltd,"1,900,000.00"
58,59,Abdos Lamitubes Private Limited,"1,900,000.00"
59,60,East India Commodites Private Limited,"1,900,000.00"
60,61,Pilani Investment And Industries Corporation Limited,"1,900,000.00"
61,62,Acclaris Business Solutions Private Limited,"1,900,000.00"
62,63,Rsh Global Private Limited,"1,900,000.00"
63,64,The Punjab Produce & Trading Co. Pvt. Ltd.,"1,800,000.00"
64,65,Mangalam Fashions Limited,"1,700,000.00"
65,66,Woodside Fashions Limited,"1,700,000.00"
66,67,S G S India Private Limited,"1,700,000.00"
67,68,Mitsubishi Corporation India Private Limited,"1,700,000.00"
68,69,Central India Industries Ltd.,"1,600,000.00"
69,70,Manaksia Limited,"1,600,000.00"
70,71,Jekay International Track Pvt. Ltd.,"1,600,000.00"
71,72,Ebell Fashions Private Limited,"1,500,000.00"
72,73,Vinayak Dealer Pvt Ltd,"1,500,000.00"
73,74,R.V. Investment And Dealers Ltd,"1,500,000.00"
74,75,Mitsui And Co India Private Limited,"1,500,000.00"
75,76,East India Securities Ltd,"1,500,000.00"
76,77,Vardhan Ltd.,"1,400,000.00"
77,78,J Thomas & Co Pvt Ltd,"1,400,000.00"
78,79,Badulipar Ltd,"1,300,000.00"
79,80,Turtle Limited,"1,300,000.00"
80,81,Boi Shareholding Limited,"1,300,000.00"
81,82,Gpt Infraprojects Limited,"1,200,000.00"
82,83,T P Roy Chowdhury & Co Private Limited,"1,200,000.00"
83,84,Emdee Digitronics Private Limited,"1,200,000.00"
84,85,Bajaj Finserv Limited,"1,200,000.00"
85,86,Gillanders Arbuthnot & Co Ltd,"1,100,000.00"
86,87,Rsm Estates Limited,"1,100,000.00"
87,88,The New India Assurance Company Limited,"1,100,000.00"
88,89,Bateli Tea Co Ltd,"1,000,000.00"
89,90,Adhunik Industries Limited,"1,000,000.00"
90,91,Etc Agro Processing (India) Private Limited,"1,000,000.00"
91,92,Arcum Engineering Pvt Ltd,"1,000,000.00"
92,93,Sreeleathers Limited,"1,000,000.00"
93,94,T S Roadways Pvt Ltd,"1,000,000.00"
94,95,Deeplok Securities Limited,"1,000,000.00"
95,96,West Bengalstate Electricity Transmission Company Limited,"1,000,000.00"
96,97,Kiran Vyapar Ltd.,"1,000,000.00"
97,98,Star Chemicals (Bombay) Private Limited,"1,000,000.00"
98,99,Intelligent Infrastructure Limited,"1,000,000.00"
99,100,Daulat Financial Services Pvt Ltd,"1,000,000.00"
100,101,Rsm Builders & Securities Private Limited,"1,000,000.00"
101,102,Deeplok Financial Services Ltd,"900,000.00"
102,103,Rba Properties Limited,"900,000.00"
103,104,Indian Railway Finance Corporation Limited,"900,000.00"
104,105,Kirtivardhan Finvest Services Limited,"900,000.00"
105,106,Adhunik Corporation Limited,"900,000.00"
106,107,Eden Real Estates Private Limited,"900,000.00"
107,108,Magus Marketing Pvt Ltd,"900,000.00"
108,109,Parcon (India) Pvt Ltd,"800,000.00"
109,110,Esab India Limited,"800,000.00"
110,111,Iac Electricals Pvt Ltd,"700,000.00"
111,112,Metal One Corporation India Private Limited,"700,000.00"
112,113,Krishna Tissues Private Limited,"700,000.00"
113,114,Avant Garde Re-Energy Private Limited,"700,000.00"
114,115,Mint Investments Ltd,"600,000.00"
115,116,Radhamani Textiles Private Limited,"600,000.00"
116,117,Peerless Hotels Ltd.,"600,000.00"
117,118,Naga Dhunseri Group Ltd.,"500,000.00"
118,119,Grand Royale Enterprises Limited,"500,000.00"
119,120,Bengal Park Chambers Housing Development Limited,"500,000.00"
120,121,Coral India Finance And Housing Limited,"500,000.00"
121,122,Rkbk Limited,"500,000.00"
122,123,Iifl Wealth Management Limited,"500,000.00"
123,124,Smc Global Securities Limited,"500,000.00"
124,125,D. Navinchandra Gems Private Limited,"500,000.00"
125,126,Tractors India Private Limited,"500,000.00"
126,127,Adventz Securities Enterprises Limited,"500,000.00"
127,128,Merlin Holdings Pvt. Ltd.,"500,000.00"
128,129,Amore Jewels Private Limited,"500,000.00"
129,130,Bpc Tradecomm Pvt Ltd,"500,000.00"
130,131,Ambuja Neotia Holdings Private Limited,"400,000.00"
131,132,Ludlow Jute & Specialities Limited,"400,000.00"
132,133,Ifb Industries Ltd,"400,000.00"
133,134,International Combustion (India) Ltd,"400,000.00"
134,135,Swiss Singapore India Private Limited,"400,000.00"
135,136,National Insurance Co Ltd,"400,000.00"
136,137,Andrew Yule & Co Ltd,"300,000.00"
137,138,Prometric Testing Private Limited Tfr. From Delhi To Haryana,"300,000.00"
138,139,Induss Food Products & Equipments Limited,"300,000.00"
139,140,Golden Goenka Fincorp Limited,"300,000.00"
140,141,India Sme Asset Reconstruction Company Limited,"300,000.00"
141,142,Spencer And Company Limited,"300,000.00"
142,143,Sbicap Trustee Company Limited,"300,000.00"
143,144,Janalakshmi Financial Services Limited,"300,000.00"
144,145,Dream Bake Private Limited,"300,000.00"
145,146,Nagreeka Exports Ltd.,"300,000.00"
146,147,Pushpak Steel Industries Private Limited,"300,000.00"
147,148,S & Ib Services Private Limited,"200,000.00"
148,149,Carbon Finance Limited,"200,000.00"
149,150,G.D. Pharmaceuticals Private Limited,"200,000.00"
150,151,Jagson Colorchem Limited,"200,000.00"
151,152,Nezone Strips Limited,"200,000.00"
152,153,Krishi Rasayan Exports Pvt.Ltd.,"200,000.00"
153,154,Mitsubishi Elevator India Private Limited,"200,000.00"
154,155,Strassenburg Pharmaceuticals Ltd.,"200,000.00"
155,156,Agriculture Insurance Company Of India Limited,"200,000.00"
156,157,Jet Age Securities Pvt Ltd,"200,000.00"
157,158,Sundaram Bnp Paribas Home Finance Limited,"200,000.00"
158,159,Emmbi Industries Limited,"200,000.00"
159,160,West Bengalstate Electricity Distribution Company Limited,"100,000.00"
160,161,Goodcare Pharma Pvt Ltd,"100,000.00"
161,162,Siro Clinpharm Private Limited,"100,000.00"
162,163,Ginza Industries Ltd.,"100,000.00"
163,164,Maheshwari Mining Private Limited,"100,000.00"
164,165,Aakarshan Tracom Private Limited,"100,000.00"
165,166,Sks Capital & Research Private Limited,"100,000.00"
166,167,Inland World Logistics Private Limited,"100,000.00"
167,168,Alliance Mills (Lessees) Ltd,"100,000.00"
168,169,Bridge & Roof Co (India) Ltd,"100,000.00"
169,170,Williamson Financial Services Limited,0.00
170,171,Regent Electro-Mech Private Limited,0.00
171,172,Noida Power Company Limited,0.00
172,173,Strategic Marketing Solutions And Research Centre Private Limited,0.00
173,174,Amgoorie India Ltd,0.00
174,175,Integrated Coal Mining Ltd,0.00
175,176,Onprocess Technology India Private Limited,0.00
176,177,Avr Storage Tank Terminals Private Limited,0.00
177,178,Madhumita Construction Pvt Ltd,0.00
178,179,Dmt Consulting Private Limited,0.00
179,180,Dey S Medical (U P) Private Limited,0.00
180,181,Rungta Agencies Pvt Ltd,0.00
181,182,Ronak Optik India Private Limited,0.00
182,183,Game Plan Sports Private Limited,0.00
183,184,Mili Consultants And Investment Pvt Ltd,0.00
184,185,Dwarkesh Engineering Works Pvt Ltd,0.00
185,186,Bijni Dooars Tea Co Ltd,0.00
186,187,Celex Technologies Private Limited,0.00
187,188,Avees Trading & Finance Pvt Ltd.,0.00
188,189,Pensol Industries Limited,0.00
189,190,Central India General Agents Ltd,0.00
190,191,Eureka Stock & Share Broking Services Limited,0.00
191,192,Greatwall Vanijya Ltd,0.00
192,193,Warren Tea Limited,0.00
193,194,Jaya Tracom Private Limited,0.00
194,195,Impex Ferro Tech Ltd,0.00
195,196,Power Grid Corporation Of India Limited,0.00
196,197,Neogold Vyapaar Private Limited,0.00
197,198,Mega Resources Ltd,0.00
198,199,Jre Tank Terminals Private Limited,0.00
199,200,Krishna Chandra Dutta(Spice) Pvt Ltd,0.00
200,201,Lebong Investments Private Limited,0.00
201,202,J D Marketing Pvt Ltd,0.00
202,203,Jet Age Finance Pvt. Ltd.,0.00
203,204,Apurva Export Pvt Ltd,0.00
204,205,India Infoline Housing Finance Limited,0.00
205,206,Akg Finvest Ltd,0.00
206,207,Sidhidata Tradecomm Limited,0.00
207,208,Desai Construction Private Limited,0.00
208,209,Magma Housing Finance Limited,0.00
209,210,Japfa Comfeed India Private Limited,0.00
210,211,Shree Harivansh Securities Private Limited,0.00
211,212,Placid Limited,0.00
212,213,Spencer International Hotels Limited,0.00
213,214,Kb Capital Markets Pvt Ltd,0.00
214,215,Altius Management Advisors Private Limited,0.00
215,216,Digital Radio (Kolkata) Broadcasting Limited,0.00
216,217,Jagaran Microfin Private Limited,0.00
217,218,Bengal Kyal Housing Development Limited,0.00
218,219,Crosseas Capital Services Private Limited,0.00
219,220,Heritage Health Insurance Tpa Private Limited,0.00
220,221,Vijaya Homes Private Limited,0.00
221,222,Swapna Printing Works Pvt Ltd,0.00
222,223,Btl Epc Limited,0.00
223,224,Sumathi Construction Private Limited,0.00
224,225,K B Saha & Sons Industries Private Limited,0.00
225,226,Joonktollee Tea & Industries Ltd.,0.00
226,227,Dhariwal Infrastructure Limited,0.00
227,228,Uno Metals Ltd,0.00
228,229,Deepak Industries Ltd,0.00
229,230,Infosoft Global Private Limited,0.00
