,SNo.,company,amount
0,1,Reliance Infrastructure Limited,"321,600,000.00"
1,2,Hdfc Bank Limited,"71,000,000.00"
2,3,Icici Home Finance Company Limited,"59,500,000.00"
3,4,Il&Fs; Financial Services Limited,"52,200,000.00"
4,5,Jm Financial Products Limited,"47,000,000.00"
5,6,Citicorp Finance (India) Limited,"29,100,000.00"
6,7,Ecgc Limited,"26,400,000.00"
7,8,Bachhraj And Company Private Limited,"26,200,000.00"
8,9,Jm Financial Asset Reconstruction Company Limited,"20,500,000.00"
9,10,Reliance Home Finance Limited,"20,400,000.00"
10,11,Kotak Mahindra Prime Limited,"20,000,000.00"
11,12,Capri Global Capital Limited,"16,300,000.00"
12,13,Reliance General Insurance Company Limited,"16,300,000.00"
13,14,Idbi Federal Life Insurance Company Limited,"15,900,000.00"
14,15,Tata Capital Housing Finance Limited,"15,000,000.00"
15,16,Bses Rajdhani Power Limited,"14,800,000.00"
16,17,Morgan Stanley India Primary Dealer Private Limited,"14,500,000.00"
17,18,Aditya Birla Finance Limited,"14,500,000.00"
18,19,Goldman Sachs (India) Capital Markets Private Limited,"14,300,000.00"
19,20,L&T; Infrastructure Finance Company Limited,"13,400,000.00"
20,21,The New India Assurance Company Limited,"13,300,000.00"
21,22,Jm Financial Credit Solutions Limited,"13,100,000.00"
22,23,Mahindra Rural Housing Finance Limited,"12,900,000.00"
23,24,M. Pallonji Logistics Private Limited,"12,600,000.00"
24,25,Kotak Mahindra Old Mutual Life Insurance  Limited,"12,000,000.00"
25,26,Tata Investment Corporation Limited,"11,900,000.00"
26,27,Gagandeep Credit Capital Private Limited,"11,100,000.00"
27,28,Reliance Nippon Life Insurance Company Limited,"11,100,000.00"
28,29,Dharmayug Investments Ltd,"10,500,000.00"
29,30,Barclays Securities (India) Private Limited,"10,400,000.00"
30,31,Indostar Capital Finance Limited,"10,200,000.00"
31,32,Sbi Dfhi Limited,"10,000,000.00"
32,33,A. K. Capital Finance Private Limited,"10,000,000.00"
33,34,Infina Finance Private Limited,"10,000,000.00"
34,35,J. P. Morgan Advisors India Private Limited,"9,800,000.00"
35,36,J.P. Morgan Securities India Private Limited,"9,200,000.00"
36,37,Credit Suisse Finance (India) Private Limited,"9,000,000.00"
37,38,Aditya Birla Sun Life Insurance Company Limited,"8,400,000.00"
38,39,Capital First Limited,"8,100,000.00"
39,40,Volkswagen Finance Private Limited,"7,700,000.00"
40,41,Rbl Bank Limited,"7,600,000.00"
41,42,Reliance Strategic Investments Limited,"7,300,000.00"
42,43,Govik Electricals Private Limited,"7,000,000.00"
43,44,Hdb Financial Services Limited,"7,000,000.00"
44,45,Altico Capital India Private Limited,"6,800,000.00"
45,46,Goldman Sachs (India) Finance Private Limited,"6,400,000.00"
46,47,Pnb Housing Finance Limited,"6,400,000.00"
47,48,Bajaj Sevashram Private Limited,"6,200,000.00"
48,49,L&T; Infra Debt Fund Limited,"6,000,000.00"
49,50,Reliance Ventures Limited,"5,300,000.00"
50,51,Bajaj Finance Limited,"5,300,000.00"
51,52,Jsw Holdings Limited,"5,100,000.00"
52,53,Engineering And Agencies Pvt Ltd,"5,000,000.00"
53,54,Bajaj Allianz Life Insurance Company Limited,"5,000,000.00"
54,55,Dcb Bank Limited,"5,000,000.00"
55,56,Winro Commercial (India) Ltd,"5,000,000.00"
56,57,Propellum Infotech Private Limited,"5,000,000.00"
57,58,Chevron Phillips Chemicals India Private  Limited,"4,800,000.00"
58,59,Julius Baer Capital (India) Private Limited,"4,300,000.00"
59,60,Ambit Private Limited,"4,200,000.00"
60,61,Synergia Life Sciences Private Limited,"4,000,000.00"
61,62,Nomura Capital (India) Private Limited,"3,900,000.00"
62,63,Neelammegha Investment And Trading Co Pvt Ltd,"3,800,000.00"
63,64,Hdfc Holdings Limited,"3,800,000.00"
64,65,Baroda Industries Private Limited,"3,600,000.00"
65,66,L&T; Finance Holdings Limited,"3,500,000.00"
66,67,Hdfc Credila Financial Services Private Limited,"3,400,000.00"
67,68,Infrastructure Leasing And Financial Services Limited,"3,200,000.00"
68,69,Rational Art And Press Private Limited,"3,200,000.00"
69,70,Tata Aig General Insurance Company Limited,"3,100,000.00"
70,71,Idfc Limited,"3,100,000.00"
71,72,Dewan Housing Finance Corporation Limited,"3,100,000.00"
72,73,Amore Jewels Private Limited,"3,100,000.00"
73,74,Global Aviation Services Private Limited,"3,000,000.00"
74,75,Irep Credit Capital Private Limited,"3,000,000.00"
75,76,Hdfc Investments Limited,"3,000,000.00"
76,77,C M Jain Impex And Investments Private Limited,"3,000,000.00"
77,78,Kotak Mahindra Investments Limited,"3,000,000.00"
78,79,Hdfc Standard Life Insurance Company Limited,"2,900,000.00"
79,80,Pegasus Assets Reconstruction Private Limited,"2,800,000.00"
80,81,Nutron Pharmaceuticals Private Limited,"2,700,000.00"
81,82,Alco Company Private Limited,"2,700,000.00"
82,83,Raheja Qbe General Insurance Company Limited,"2,700,000.00"
83,84,Saraswati Commercial (India) Ltd,"2,700,000.00"
84,85,Hamilton & Company Limited,"2,700,000.00"
85,86,Paragon Property Enterprises Private Limited,"2,500,000.00"
86,87,Aesthetic Builders Private Limited,"2,500,000.00"
87,88,Bellwether Capital Private Limited,"2,500,000.00"
88,89,Kc Maritime (India) Limited,"2,500,000.00"
89,90,Parle Bisleri Private Limited,"2,500,000.00"
90,91,Edelweiss Housing Finance Limited,"2,500,000.00"
91,92,Goodwill Warehousing Private Limited,"2,500,000.00"
92,93,Aquamarine Realty Private Limited,"2,500,000.00"
93,94,Beehive Communications Private Limited,"2,500,000.00"
94,95,Sound Securities Private Limited,"2,500,000.00"
95,96,L&T; Finance Limited,"2,400,000.00"
96,97,Pakona Engineers (India)Pvt Ltd,"2,400,000.00"
97,98,Ambit Finvest Private Limited,"2,200,000.00"
98,99,Neutron Enterprises Private Limited,"2,200,000.00"
99,100,Il&Fs; Tamil Nadu Power Company Limited,"2,100,000.00"
100,101,Industrial Investment Trust Limited,"2,100,000.00"
101,102,Sharekhan Commodities Private Limited,"2,100,000.00"
102,103,Hd Fire Protect Private Limited,"2,100,000.00"
103,104,Apax Partners India Advisers Private Limited,"2,000,000.00"
104,105,Resin Distributors Limited,"2,000,000.00"
105,106,Kkr India Financial Services Private Limited,"2,000,000.00"
106,107,Ronuplate Private Limited.,"2,000,000.00"
107,108,Abhiraj Trading And Investments Private Limited,"2,000,000.00"
108,109,Tata Capital Limited,"1,900,000.00"
109,110,Reliance Welfare Association,"1,900,000.00"
110,111,Aadhar Housing Finance Limited,"1,900,000.00"
111,112,Acg Inspection Systems Private Limited,"1,900,000.00"
112,113,Idfc Bank Limited,"1,900,000.00"
113,114,Bhishma Realty Limited,"1,800,000.00"
114,115,Si Investments And Broking Private Limited,"1,800,000.00"
115,116,Eurokids International Private Limited,"1,700,000.00"
116,117,The Swastik Safe Deposit And Investments  Ltd,"1,700,000.00"
117,118,Elan Pharma (India) Private Limited,"1,700,000.00"
118,119,Enam Asset Management Company Private Lmited,"1,700,000.00"
119,120,Bachhraj Factories Private Limited,"1,600,000.00"
120,121,Valmet Automation Private Limited,"1,600,000.00"
121,122,Axis Bank Limited,"1,600,000.00"
122,123,Pil Mumbai Private Limited,"1,600,000.00"
123,124,Macquarie Finance (India) Private Limited,"1,500,000.00"
124,125,Icpa Health Products Ltd,"1,500,000.00"
125,126,Bdr Lifesciences Private Limited,"1,500,000.00"
126,127,Syntel Solutions (India) Private Limited,"1,500,000.00"
127,128,Bang Equity Broking Private Limited,"1,500,000.00"
128,129,Mystique Realty Private Limited,"1,500,000.00"
129,130,Amerigo Realty Private Limited,"1,500,000.00"
130,131,Thakorlal Hiralal Exports Private Limited,"1,400,000.00"
131,132,Spencer International Hotels Limited,"1,400,000.00"
132,133,Camart Finance Limited,"1,400,000.00"
133,134,Wallem Shipmanagement (India) Private Limited,"1,400,000.00"
134,135,Cdsl Ventures Limited,"1,400,000.00"
135,136,Crest Ventures Limited,"1,400,000.00"
136,137,Kangaroo Kids Education Limited,"1,400,000.00"
137,138,Mahaavir Universal Homes Private Limited,"1,300,000.00"
138,139,Legasis Services Private Limited,"1,300,000.00"
139,140,Futura Commercials Private Limited,"1,300,000.00"
140,141,Coface India Credit Management Services Private Limited,"1,300,000.00"
141,142,India Index Services And Products Limited,"1,300,000.00"
142,143,Moody International (India) Private Limited,"1,300,000.00"
143,144,The Associated Auto Parts Private Limited,"1,200,000.00"
144,145,Dhanki Securities Private Limited,"1,200,000.00"
145,146,Sudarshan Fiscal Services Pvt Ltd,"1,200,000.00"
146,147,Marwah Steels Private Limited,"1,200,000.00"
147,148,Forevermark Diamonds Private Limited,"1,200,000.00"
148,149,Advent India Pe Advisors Private Limited,"1,200,000.00"
149,150,Anibrain Digital Technologies Private Limited,"1,200,000.00"
150,151,Gavs Technologies Private Limited,"1,200,000.00"
151,152,Commtel Networks Private Limited,"1,200,000.00"
152,153,Tcfc Finance Limited,"1,200,000.00"
153,154,Cisco Systems Capital (India) Private Limited,"1,200,000.00"
154,155,Chorus Call Conferencing Services India Private Limited,"1,200,000.00"
155,156,Messe Frankfurt Trade Fairs India Private Limited,"1,100,000.00"
156,157,Nexus India Capital Advisors Private Limited,"1,100,000.00"
157,158,Anand Investment Private Limited,"1,100,000.00"
158,159,Mehboob Production Private Limited,"1,100,000.00"
159,160,Future Generali India Insurance Company Limited,"1,100,000.00"
160,161,Omidyar Network India Advisors Private Limited,"1,100,000.00"
161,162,Zodiac Finsec And Holdings Limited,"1,100,000.00"
162,163,Aavishkaar Venture Management Services Private Limited,"1,100,000.00"
163,164,Bses Yamuna Power Limited,"1,100,000.00"
164,165,India Infoline Housing Finance Limited,"1,100,000.00"
165,166,G.D.Birla Medical Research And Education  Foundation,"1,100,000.00"
166,167,Hinduja Finance Limited,"1,100,000.00"
167,168,Birla Management Centre Services Limited,"1,100,000.00"
168,169,Hapag-Lloyd India Private Limited,"1,000,000.00"
169,170,Sykes And Ray Equities (India ) Ltd,"1,000,000.00"
170,171,Ram Ratna Infrastructure Pvt Limited,"1,000,000.00"
171,172,Nomura Fixed Income Securities Private Limited,"1,000,000.00"
172,173,Siddhesh Capital Market Services Private  Limited,"1,000,000.00"
173,174,Fedbank Financial Services Limited,"1,000,000.00"
174,175,Christie'S India Private Limited,"1,000,000.00"
175,176,Sarovar Hotels Private Limited,"1,000,000.00"
176,177,Bang Securities Private Limited,"1,000,000.00"
177,178,Ratanchand Investment Private Limited,"1,000,000.00"
178,179,Citec Engineering India Private Limited,"1,000,000.00"
179,180,Star Chemicals (Bombay) Private Limited,"1,000,000.00"
180,181,Lakhani Dyestuffs Private Limited,"900,000.00"
181,182,Altitude Investments Private Limited,"900,000.00"
182,183,Propiedades Realties Private Limited,"900,000.00"
183,184,Zeus Air Services Private Limited,"900,000.00"
184,185,Hi-Point Services (India) Private Limited,"900,000.00"
185,186,Hsbc Professional Services (India) Private Limited,"900,000.00"
186,187,Synergy Synthetics Private Limited,"900,000.00"
187,188,Pdm Media (India) Private Limited,"800,000.00"
188,189,Moldex Composites Private Limited,"800,000.00"
189,190,Karun Carpets Private Limited,"800,000.00"
190,191,Priyanka Finance Private Limited,"800,000.00"
191,192,Idfc Infrastructure Finance Limited,"800,000.00"
192,193,Ind-Finance And Securities Trust Private  Limited,"800,000.00"
193,194,Af-Taab Investment Company Limited,"800,000.00"
194,195,Deutsche India Holdings Private Limited,"800,000.00"
195,196,New Silk Route Advisors Private Limited,"800,000.00"
196,197,Janalakshmi Financial Services Limited,"800,000.00"
197,198,Navdeep Chemicals Private Limited,"700,000.00"
198,199,Shanteri Investment Private Limited,"700,000.00"
199,200,Spa Holdings Private Limited,"700,000.00"
200,201,Capital First Home Finance Limited,"700,000.00"
201,202,Maritime Services Private Limited,"700,000.00"
202,203,Geecee Investments Limited,"700,000.00"
203,204,Indrajit Power Private Limited,"700,000.00"
204,205,Radius Corporate Solutions (India) Private Limited,"700,000.00"
205,206,Valuequest Investment Advisors Private Limited,"700,000.00"
206,207,Vistra Itcl (India) Limited,"600,000.00"
207,208,The Anglo Scottish Education Society,"600,000.00"
208,209,Securities Investment Management Private  Limited,"600,000.00"
209,210,Healthindia Insurance Tpa Services Private Limited,"600,000.00"
210,211,Ehara Engineering Pvt Ltd,"600,000.00"
211,212,P H Financial And Investment Consultants  Pvt Ltd,"600,000.00"
212,213,Irclass Systems And Solutions Private Limited,"600,000.00"
213,214,Brookfield India Office Parks Private Limited,"500,000.00"
214,215,Motilal Oswal Financial Services Limited,"500,000.00"
215,216,Dgp Securities Limited,"500,000.00"
216,217,Powermaster Engineers Private Limited,"500,000.00"
217,218,Oilex Enginers (India) Pvt Ltd,"500,000.00"
218,219,Pashupati Capital Services Private Limited,"500,000.00"
219,220,Edelweiss Retail Finance Limited,"500,000.00"
220,221,Orix Leasing & Financial Services India Limited,"500,000.00"
221,222,Helion Advisors Private Limited,"500,000.00"
222,223,Cafco Consultants Limited,"500,000.00"
223,224,Sbicap Trustee Company Limited,"500,000.00"
224,225,Tata Trustee Company Limited,"500,000.00"
225,226,Tata Capital Financial Services Limited,"500,000.00"
226,227,Meso Private Limited,"500,000.00"
227,228,Pentel Stationery (India) Private Limited,"500,000.00"
228,229,Syntel Global Private Limited,"400,000.00"
229,230,General Industrial Controls Pvt Ltd,"400,000.00"
230,231,Pinky Ventures Private Limited,"400,000.00"
231,232,Suparna Chemicals Limited,"400,000.00"
232,233,Illuminati Trading Private Limited,"400,000.00"
233,234,Tata Cleantech Capital Limited,"400,000.00"
234,235,Seattle Power Solutions Private Limited,"400,000.00"
235,236,Tyson Enterprises Private Limited,"400,000.00"
236,237,Morgan Stanley India Securities Private Limited,"400,000.00"
237,238,Saba Software India Private Limited,"400,000.00"
238,239,Hurix Systems Private Limited,"300,000.00"
239,240,A.T.E. Private Limited,"300,000.00"
240,241,Mindset Securities Private Limited,"300,000.00"
241,242,Adam Fabriwerk Private Limited,"300,000.00"
242,243,Iifl Wealth Finance Limited,"300,000.00"
243,244,Peass Industrial Engineers Private Limited,"300,000.00"
244,245,Creative Stylo Packs Private Limited,"300,000.00"
245,246,Micro Housing Finance Corporation Limited,"200,000.00"
246,247,Kkr India Asset Finance Private Limited,"200,000.00"
247,248,Patani Securities Private Limited,"200,000.00"
248,249,L&T; Housing Finance Limited,"200,000.00"
249,250,Techno Process Equipments (India) Private Limited,"200,000.00"
250,251,Novex Poly Films Private Limited,"200,000.00"
251,252,Uni Klinger Limited,"200,000.00"
252,253,Nuevo Consultancy Services Private Limited,"200,000.00"
253,254,The New Piece Goods Bazar Company Limited,"200,000.00"
254,255,Arofine Polymers Private Limited,"100,000.00"
255,256,Idbi Bank Limited,"100,000.00"
256,257,The Oriental Insurance Company Limited,"100,000.00"
257,258,Shriram Transport Finance Company Limited,"100,000.00"
258,259,Hema Laboratories Pvt Ltd,"100,000.00"
259,260,Kkr India Advisors Private Limited,"100,000.00"
260,261,Yesha Electricals Private Limited,"100,000.00"
261,262,Temasek Holdings Advisors India Private Limited,"100,000.00"
262,263,Clean Max Enviro Energy Solutions Private Limited,"100,000.00"
263,264,Shriram Housing Finance Limited,"100,000.00"
264,265,Shardul Securities Limited,"100,000.00"
265,266,Polysil Irrigation Systems Private Limited,"100,000.00"
266,267,Bluechip Insurance Broking Private Limited,0.00
267,268,Kanunga Metals Private Limited,0.00
268,269,Learning Mate Solutions Private Limited,0.00
269,270,N A Sportz Interactive Private Limited,0.00
270,271,Lexi Private Limited,0.00
271,272,M J Shares And Securities Private Limited,0.00
272,273,E-Emphasys Infotech Private Limited,0.00
273,274,Getty Images Media India Private Limited,0.00
274,275,Indiafirst Life Insurance Company Limited,0.00
275,276,Ifiunik Pharmaceuticals Limited,0.00
276,277,Fortune Intercontinental Private Limited,0.00
277,278,Sanvo Resorts Private Limited,0.00
278,279,A G Superstructures Private Limited,0.00
279,280,Gardenia Cosmocare Private Limited,0.00
280,281,Vindhyachal Hydro Power Private Limited,0.00
281,282,Nulife Global Medical Devices Private Limited,0.00
282,283,Inspire Films Private Limited,0.00
283,284,Sustainable Agro-Commercial Finance Limited,0.00
284,285,Edelweiss Tokio Life Insurance Company Limited,0.00
285,286,Sirmaxo Chemicals Pvt Ltd,0.00
286,287,Adventz Securities Enterprises Limited,0.00
287,288,Yang Ming Line (India) Private Limited,0.00
288,289,Ashish Fiscal Services Private Limited,0.00
289,290,Tata Sons Limited,0.00
290,291,Tata Industries Limited,0.00
291,292,Merind Limited,0.00
292,293,Riaan Ventures Private Limited,0.00
293,294,Cpl Aromas Private Limited,0.00
294,295,B Arunkumar Capital And Credit Services Private Limited,0.00
295,296,Lekar Pharma Limited,0.00
296,297,Advanced Bio-Agro Tech Limited,0.00
297,298,M Pallonji Shipping Pvt Ltd,0.00
298,299,Chokhani Securities Limited,0.00
299,300,Chemocid Impex Private Limited,0.00
300,301,Nagarwalla Enginering Company Private Limited,0.00
301,302,Bharat Containers (Nagpur) Pvt Ltd,0.00
302,303,Microworld Software Services Private Limited,0.00
303,304,Akashdeep International Private Limited,0.00
304,305,Hemani Chemiorganic Private Limited,0.00
305,306,Panatone Finvest Limited,0.00
306,307,Tyresoles (India) Private Limited,0.00
307,308,Electralloy Special Steel Castings Private Limited,0.00
308,309,Seahorse Ship Agencies Pvt Ltd,0.00
309,310,Sbi Life Insurance Company Limited,0.00
310,311,Gabs Investments Private Limited,0.00
311,312,Tradelink Exim (India) Private Limited,0.00
312,313,Radha Krishna Properties Private Limited,0.00
313,314,Dimple Realtors Private Limited,0.00
314,315,Tmf Services India Private Limited,0.00
315,316,Thakur Fininvest Private Limited,0.00
316,317,Ashrit Holdings Limited,0.00
317,318,Sethi & Sethi Comfort Products Private Limited,0.00
318,319,Scorpio Marine Management (India) Private Limited,0.00
319,320,B.V.Chinai And Co. (India) Private Limited,0.00
320,321,Soex India Private Limited,0.00
321,322,Nahar Builders And Developers Limited,0.00
322,323,Cargo Service Center India Private Limited,0.00
323,324,Aksr Corporate Advisors Private Limited,0.00
324,325,Erudite Eduventures Private Limited,0.00
325,326,Ican Investments Advisors Private Limited,0.00
326,327,Wilson Pen Private Limited,0.00
327,328,Grand Royale Enterprises Limited,0.00
328,329,C N Sanghavi And Company (Forwards) Private Limited,0.00
329,330,Borsad Tobacco Company Private Limited,0.00
330,331,Hamlet Constructions (India ) Private Limited,0.00
331,332,Bangla Entertainment Private Limited,0.00
332,333,I R Technology Services Private Limited,0.00
333,334,Teesta Retail Private Limited,0.00
334,335,Scil Ventures Limited,0.00
335,336,Airoplast Private Limited,0.00
336,337,Manba Finance Limited,0.00
337,338,Vividh Finvest Private Limited,0.00
338,339,Harit Exports Limited,0.00
339,340,Shree Madhur Realtors Private Limited,0.00
340,341,Beeline Impex Private Limited,0.00
341,342,Rapport Outdoor Advertising Private Limited,0.00
342,343,Media Research Users Council,0.00
343,344,Atlas Equifin Private Limited,0.00
344,345,Dynamic Prestress Projects And Services Private Limited,0.00
345,346,Maq Software Hyderabad Private Limited,0.00
346,347,Sadafuli Finvest Pvt Ltd(Tr Co From Maharashtra),0.00
347,348,Jamnalal Sons Private Limited,0.00
348,349,Arti Properties Private Limited,0.00
349,350,Byramjee Jeejeebhoy Private Limited,0.00
350,351,Matrix Waste Management Private Limited,0.00
351,352,Makwell Plastisizers Private Limited,0.00
352,353,Jnj Holdings Private Limited,0.00
353,354,Siro Clinpharm Private Limited,0.00
354,355,Ronuk Metafin Private Limited,0.00
355,356,Millennium Consulting (India) Private Limited,0.00
356,357,Shreyas Morakhia And Famiily Assets Private Limited,0.00
357,358,Nova Synthetic Limited,0.00
358,359,Fem Constructions (India) Private Limited,0.00
359,360,Beam Developers Private Limited,0.00
360,361,Hamburg Sud India Private Limited,0.00
361,362,Xander Finance Private Limited,0.00
362,363,Anand Rathi Global Finance Limited,0.00
363,364,Dynamic Prestress India Pvt Ltd,0.00
364,365,Scrabble Digital Limited,0.00
365,366,H And M Housing Finance And Leasing Private Limited,0.00
366,367,Webex Communications (India) Private Limited,0.00
367,368,Aditya Birla Power Company Limited,0.00
368,369,Seaprincess Hotels And Properties Private Limited,0.00
369,370,Marriott Hotels India Private Limited (Trf.),0.00
370,371,Concordia International (India) Services Private Limited,0.00
371,372,Magnus Properties Private Limited,0.00
372,373,Prescient Wealth Management Private Limited,0.00
373,374,Nbu Bearings Private Limited,0.00
374,375,Idfc Financial Holding Company Limited,0.00
375,376,Nirmal Bang Financial Services Private Limited,0.00
376,377,Usha Garments Manufacturing Company Private Limited,0.00
377,378,Vertex Newton Projects Private Limited,0.00
378,379,Advanced Technical And Management Consultants Private Limited,0.00
379,380,Shree Krishna Woollen Mills Private Limited,0.00
380,381,Micro Units Development & Refinance Agency Limited,0.00
381,382,Ashish Estates And Properties Pvt Ltd,0.00
382,383,Spectrum Johnson Tiles Private Limited,0.00
383,384,Safex Fire Services Limited,0.00
384,385,Prozone Intu Properties Limited,0.00
385,386,Chandurkar Investments Pvt Ltd,0.00
386,387,Amazia Fashion Private Limited,0.00
387,388,Yuvak Ventures Private Limited,0.00
388,389,Advanced Realty Private Limited,0.00
389,390,Multimodal Storage Solutions Private Limited,0.00
390,391,N Mohanlal And Company Private Limited,0.00
391,392,Rare Rose Premises Private Limited,0.00
392,393,Devu Tools Private Limited,0.00
393,394,Dhwaja Shares & Securities Private Limited,0.00
394,395,Cheay Investments Pvt Ltd,0.00
395,396,Aquarius India Manufacturing & Sourcing Private Limited,0.00
396,397,Hafsha Trading Private Limited,0.00
397,398,General Insurance Corporation Of India,0.00
398,399,Crowe Boda And Company Private Limited,0.00
399,400,Bhimrajka Impex Limited,0.00
400,401,Logus Realty Private Limited,0.00
401,402,Baumer Technologies India Private Limited,0.00
402,403,Dhwaja Commodity Services Private Limited,0.00
403,404,Jeetay Investments Pvt Ltd,0.00
404,405,Techno Tarp And Polymers Private Limited,0.00
405,406,Shree Nirmal Exports Private Limited,0.00
406,407,Home First Finance Company India Private  Limited,0.00
407,408,Radiant International Private Limited,0.00
408,409,Anurag Electronics (Gujarat) Pvt Ltd,0.00
409,410,Laser Sos (India) Private Limited,0.00
410,411,Barodawala Properties Private Limited,0.00
411,412,Neoworth Commercial Pvt Ltd,0.00
412,413,Biyani Financial Services Private Limited,0.00
413,414,Hercules Pigments Private Limited,0.00
414,415,Jaykal Exports Private Limited,0.00
415,416,Adventz Finance Private Limited,0.00
416,417,Allied Aviation Pvt Ltd,0.00
417,418,Fosma Maritime Institute And Research Organisation,0.00
418,419,Vedang Cellular Services Private Limited,0.00
419,420,Naman Finance And Investment Pvt Ltd,0.00
420,421,Viraj Estate Private Limited,0.00
421,422,Cisco Development India Private Limited,0.00
422,423,Saville Estates Private Limited,0.00
423,424,Alpex Holdings Private Limited,0.00
424,425,Ambernath Organics Private Limited,0.00
425,426,Aims Impex Private Limited,0.00
426,427,Matrix India Asset Advisors Private Limited,0.00
427,428,Thansau Decors Private Limited,0.00
428,429,Premier Opticals Pvt Ltd,0.00
429,430,Zen Pharma Private Limited,0.00
430,431,Accolade Properties Private Limited,0.00
431,432,Datamatics Business Solutions Limited,0.00
432,433,Antique Finance Private Limited,0.00
433,434,Psa Chemicals And Pharmaceuticals Pvt Ltd,0.00
434,435,Stci Finance Limited,0.00
435,436,Wilhelmsen Ship Management (India) Private Limited,0.00
436,437,Retailers Association'S Skill Council Of  India,0.00
437,438,Freight Connection India Private Limited,0.00
438,439,Samta Investrade Private Limited,0.00
439,440,Sofotel Infra Private Limited,0.00
440,441,Mobileum Technologies Private Limited,0.00
441,442,Napean Finvest Private Limited,0.00
442,443,Asha Penn Color Private Limited,0.00
443,444,Niharika Steel And Chemicals Private Limited,0.00
444,445,Sonu Realtor Private Limited,0.00
445,446,Neela Telefilms Private Limited,0.00
446,447,Diamond And Gem Development Corporation Ltd,0.00
447,448,Rahu Health And Medical Tourism Private Limited,0.00
448,449,Controlcase International Private Limited,0.00
449,450,Potential Builders Pvt Ltd,0.00
450,451,Mk Profinlease Private Limited,0.00
451,452,Welex Laboratories Private Limited,0.00
452,453,Lonza India Private Limited,0.00
453,454,Junish Composites (India) Private Limited,0.00
454,455,Paycraft Solutions Private Limited,0.00
455,456,Rajshri Entertainment Private Limited,0.00
456,457,Indo American Jewellery Limited,0.00
457,458,India Infoline Finance Limited,0.00
458,459,Award Offset Printers And Packaging Private Limited,0.00
459,460,Dk Web-Tech Private Limited,0.00
460,461,Honavar Electrodes Private Limited,0.00
461,462,Edelweiss Finvest Private Limited,0.00
462,463,Inspira Bio-Pharm Private Limited,0.00
463,464,Xpanxion International Private Limited,0.00
464,465,Genteel Trading Company Private Limited,0.00
465,466,B P Marine Academy,0.00
466,467,E-City Digital Cinemas Private Limited,0.00
467,468,Star Gold Private Limited,0.00
468,469,Max Spare Limited,0.00
469,470,Chanakya International Private Limited,0.00
470,471,Edelweiss Finance & Investments Limited,0.00
471,472,Zenith Securities And Investment Limited,0.00
472,473,Unique Pharmaceutical Laboratories Limited,0.00
