,Unnamed: 0,name,CIN,NIC,amount
0,0,3D Plm Software Solutions Limited,U72900MH2001PLC134244,72.0,4123509
1,1,3F Oil Palm Agrotech Private Limited,U15400TG2010PTC069556,15.0,0
2,2,42Gears Mobility Systems Private Limited,U72200KA2010PTC055249,,1245000
3,3,63 Moons Technologies Limited,,,12446000
4,4,A B Sugars Limited,U15421DL1997PLC128097,,889000
5,5,A B T Limited,U60231TZ1931PLC000006,49.0,2000000
6,6,A G Industries Pvt Ltd,U27300HR1991PTC031378,27.0,12
7,7,A L M Industries Limited,U19111DL1996PLC129067,,1800000
8,8,A P I Ispat And Powertech Privatelimited,U27101DL2004PTC129773,,700000
9,9,A P Refinery Private Limited,U15143PB2003PTC026245,,400000
10,10,A R B Bearings Limited,U74899DL1990PLC039861,,1070610
11,11,A R Sulphonates Private Limited,U24111WB2004PTC099677,,75000
12,12,A.B. Grain Spirits Private Limited,U15500PB2005PTC027841,,100000
13,13,A2Z Filtration Specialities Private Limited,U74999DL2002PTC115146,,1258600
14,14,Aachi Masala Food'S Private Limited,,,3400000
15,15,Aaiswarya Dyeing Mills Private Limited,U17119GJ1993PTC020372,,1700000
16,16,Aakar Investment Private Limited,U67120MH1999PTC118964,66.0,5000000
17,17,Aakash Global Foods Private Limited,U15440MP1992PTC007224,,545000
18,18,Aap Realtors Limited,U45201MH2008PLC181582,,300000
19,19,Aapc India Hotel Management Private Limited,U55101DL2004PTC130073,55.0,1300000
20,20,Aarti Industries Ltd,L24110GJ1984PLC007301,20.0,2600000
21,21,Aarti International Limited,U27109PB1993PLC014037,27.0,1705801
22,22,Aarti Steels Limited,U17115PB1979PLC003991,,6488688
23,23,Aarvee Associates Architects Engineers And Consultants Private Limited,U74200TG2005PTC045491,,200000
24,24,Aavantika Gas Limited,U40107MP2006PLC018684,40.0,1100000
25,25,Abb India Limited,L32202KA1949PLC032923,32.0,17700000
26,26,Abc Bearings Limited,L29130MH1961PLC012028,29.0,1332000
27,27,Abci Infrastructures Private Limited,U45202WB1993PTC058047,,1600000
28,28,Abco Advisory Services India Private Limited,U93000TN2008FTC069660,,2800000
29,29,Abdos Lamitubes Private Limited,U25202AS2004PTC007382,25.0,0
30,30,Abharan Jewellers Private Limited,U27205KA2011PTC058025,,393694
31,31,Abhay Nutrition Private Limited,,,90000
32,32,Abhijit Realtors & Infraventures Private Limited,U45208MH2007PTC174132,,1327750
33,33,Abhilash Chemicals And Pharmaceuticals Private Limited,U24294TN1994PTC026936,,1200000
34,34,Abi-Showatech (India) Limited,U40103TN1991PLC021872,40.0,9500000
35,35,Abil Infraprojects Limited,U45204MH1993PLC071289,45.0,5600000
36,36,Abil Realty Private Limited,U70100PN2010PTC137393,70.0,1300000
37,37,Abp Private Limited,U22219WB1922PTC004503,18.0,180000
38,38,Acb (India) Limited,U10102DL1997PLC085837,10.0,19903101
39,39,Accenture Solutions Private Limited,U72400MH1990PTC057492,,12546220
40,40,Access Healthcare Services Private Limited,U74220TN2011PTC078925,,1200000
41,41,Acclaris Business Solutions Private Limited,U74140WB2003PTC096338,,1232140
42,42,Accord Software And Systems Private Limited,U72200KA1991PTC012629,,491260
43,43,Accudyne Industries India Private Limited,U51102TN1983PTC010379,,600000
44,44,Ace Designers Limited,U29199KA1986PLC007816,29.0,4155222
45,45,Ace Hardware Private Limited,U74899DL1983PTC016052,,414050
46,46,Ace Multi Axes Systems Limited,U85110KA1995PLC018544,86.0,1862000
47,47,Ace Tyres Limited,U25112TG2001PLC037183,,0
48,48,Acg Inspection Systems Private Limited,U72300MH2009PTC192362,,799690
49,49,Acg Pampac Machines Private Limited,U27299MH1987PTC044041,,605371
50,50,Acg Pharmapack Private Limited,U45200MH2004PTC149770,,2350000
51,51,Aci Worldwide Consulting (India) Private Limited,U72200PN2004PTC019122,,6271
52,52,Aci Worldwide Solutions Private Limited,U72200KA1994PTC016336,,263281
53,53,Acme Solar Technologies (Gujarat) Private Limited,U40105HR2009PTC038901,40.0,3100000
54,54,Acquire Services Private Limited,U63040RJ1997PTC049661,,1100000
55,55,Acrysil Limited,L26914MH1987PLC042283,26.0,2073340
56,56,Acsys Investments Private Limited,U72200TN1989PTC018287,72.0,8100000
57,57,Act Infraport Limited,U45200MH2004PLC148978,,1100000
58,58,Acv Products Private Limited,U17111TZ1999PTC009087,,1000000
59,59,Ad- Manum Finance Limited,L52520MP1986PLC003405,52.0,0
60,60,Ad2Pro Media Solutions Private Limited,U72300KA2006PTC040779,72.0,1000000
61,61,Adam Fabriwerk Private Limited,U24231MH1982PTC027517,,300000
62,62,Adani Estates Private Limited,U45300GJ2005PTC046949,,7
63,63,Adani Gas Limited,U40100GJ2005PLC046553,40.0,19700000
64,64,Adani Infra (India) Limited,U45204GJ2010PLC059226,45.0,3400000
65,65,Adani Infrastructure And Developers Private Limited,,,800000
66,66,Adani Logistics Limited,U63090GJ2005PLC046419,63.0,393000
67,67,Adani Ports And Special Economic Zone Limited,L63090GJ1998PLC034182,52.0,8500000
68,68,Adani Township & Real Estate Company Private Limited,U70101GJ2012PTC071738,70.0,458000
69,69,Adani Wilmar Limited,U15146GJ1999PLC035320,10.0,16690000
70,70,Adar Poonawalla Finvest Pvt Ltd,U51503MH1985PTC035067,,500000
71,71,Addison & Co. Limited,U28939TN1914PLC000008,28.0,1200000
72,72,Adhunik Industries Limited,L65921WB1979PLC032200,64.0,110000
73,73,Adient India Private Limited,U34300PN1996PTC015038,,570000
74,74,Adithya Automotive Applications Private Limited,U34201UP2006PTC041454,34.0,800000
75,75,Aditya Birla Fashion And Retail Limited,L18101MH2007PLC233901,18.0,20381000
76,76,Aditya Birla Finance Limited,U65990GJ1991PLC064603,65.0,22910607
77,77,Aditya Birla Health Services Limited,U85199PN2001PLC019881,85.0,1274175
78,78,Aditya Birla Money Mart Limited,U61190GJ1997PLC062406,61.0,200000
79,79,Aditya Music (India) Private Limited,U32301TG2000PTC034478,,2000000
80,80,Admark Polycoats Private Limited,U24224GJ2002PTC040987,,412500
81,81,Ador Powertron Limited,U31103PN1995PLC084268,31.0,300000
82,82,Ador Welding Limited,L70100MH1951PLC008647,68.0,1619000
83,83,Adroit Industries (India) Limited,U74999MH1995PLC084474,,0
84,84,Advaith Motors Private Limited,U34300KA1998PTC023605,,300000
85,85,Advanced Enzyme Technologies Limited,U24200MH1989PLC051018,24.0,250000
86,86,Advanced Micro Devices Pvt Ltd,U74909HR1978PTC009051,,18200000
87,87,Advent Envirocare Technology Pvt Ltd,U29197GJ1996PTC028765,,300000
88,88,Advent India Pe Advisors Private Limited,U74999MH2009PTC195263,,555350
89,89,Advik Hi-Tech Private Limited,U29299PN1998PTC013028,,1161073
90,90,Adwaith Lakshmi Industries Limited,U27109TZ1991PLC003510,27.0,300000
91,91,Aerospace Materials Private Limited,U45201TZ1988PTC002113,45.0,900000
92,92,Aesthetic Builders Private Limited,U45202MH1971PTC015224,,4000000
93,93,Af-Taab Investment Company Limited,U65990MH1979PLC021037,65.0,700000
94,94,Afcons Infrastructure Limited,U45200MH1976PLC019335,45.0,3300000
95,95,Aforeserve. Com Limited,U72900WB2000PLC092058,,0
96,96,Ag8 Ventures Limited,U45201MP1997PLC012427,,400000
97,97,Agarmin Coalwashery Private Limited,U01010MP2005PTC017426,,310000
98,98,Agarwal Associates (Promoters) Ltd,U51909DL1986PLC023729,,333273
99,99,Agarwal Coal Corporation Private Limited,U23109MP2000PTC014351,,6540000
100,100,Agarwal Fuel Corporation Private Limited,U45203MP1980PTC001674,,2300000
101,101,Agarwal Marbles India Private Limited,U14101RJ1999PTC015389,,454800
102,102,Agarwal Transport Corporation Private Limited,U60210MP2003PTC015665,,2200000
103,103,Agility Logistics Private Limited,U60230MH1998PTC112960,,821195
104,104,Agm India Advisors Private Limited,U45400MH2007PTC176833,45.0,1700000
105,105,Agriculture Insurance Company Of India Limited,U74999DL2002PLC118123,74.0,11320000
106,106,Agrocel Industries Private Limited,U24210GJ1985PTC007569,,7285000
107,107,Agson Global Private Limited,U51909DL1997PTC087560,,0
108,108,Ahmedabad Strips Private Limited,U27100GJ1997PTC032714,,1002100
109,109,Aia Engineering Limited,L29259GJ1991PLC015182,29.0,2095000
110,110,Aica Laminates India Private Limited,U74120DL2011FTC248106,,200000
111,111,Aig Analytics & Services Private Limited,U74990KA2009PTC076432,,850000
112,112,Aig Data Services Private Limited,U72900KA2013FTC072059,,250000
113,113,Aimil Limited,U74899DL1972PLC006093,74.0,1159635
114,114,Air Inn Private Limited,U55101MH1982PTC026750,,980648
115,115,Airbus Group India Private Limited,U74999KA2007PTC041706,,1200000
116,116,Airvana Networks India Private Limited,U72200KA2004FTC034129,,2300000
117,117,Airwatch Technologies India Private Limited,U72200KA2010PTC056367,,2400000
118,118,Aizant Drug Research Solutions Private Limited,U24239TG2005PTC048133,,356000
119,119,Ajanta Private Limited,U33300GJ1989PTC013081,,0
120,120,Ajax Fiori Engineering (India) Private Limited,U28920KA1992PTC013306,,500000
121,121,Ajay Engi-Infrastructure Private Limited,U45209GJ2008PTC053066,,3500000
122,122,Ajay Industrial Corporation Limited.,U51909DL2008PLC180573,,1800000
123,123,Ajeet Seeds Private Limited,U01100MH1986PTC039814,,45200000
124,124,Ajwani Infrastructure Private Limited,U45201MH1986PTC040568,,200000
125,125,Akashdeep International Private Limited,U74140MH1995PTC084537,,1000000
126,126,Aker Powergas Subsea Private Limited,U74990MH2010PTC210736,,9600000
127,127,Akshar Impex Private Limited,U51100MH2006PTC200588,,2500000
128,128,Aksharchem (India ) Limited,L24110GJ1989PLC012441,20.0,1400000
129,129,Akums Drugs And Pharmaceuticals Limited,U24239DL2004PLC125888,,32000000
130,130,Akzo Nobel India Limited,L24292WB1954PLC021516,24.0,12800000
131,131,Al-Faheem Meatex Private Limited,U01214UP1996PTC020905,,54200000
132,132,Al-Hamd Agro Food Products Private Limited,U15116UP2003PTC027403,,3275031
133,133,Alchemy Capital Management Private Limited,U67120MH1999PTC119811,66.0,3100000
134,134,Alco Company Private Limited,U66010MH1944PTC004164,,775000
135,135,Alcon Laboratories (India) Private Limited,U33119KA1999FTC025496,,500000
136,136,Alcon Resort Holdings Private Limited,U70101GA1988PTC000841,,17855
137,137,Alcove Construction Pvt Ltd,U70101WB1996PTC079790,,51000
138,138,Alembic Pharmaceuticals Limited,L24230GJ2010PLC061123,24.0,50150000
139,139,Alf Engineering Private Limited,U28900MH2006PTC160179,,6000000
140,140,Alicon Castalloy Limited,L99999PN1990PLC059487,99.0,4492002
141,141,Alkem Laboratories Limited,U00305MH1973PLC174201,0.0,4300000
142,142,Allegis Services (India) Private Limited,U74140KA2005PTC035624,,2903481
143,143,Allergan Healthcare India Private Limited,U85190KA2008PTC048318,85.0,0
144,144,Alliance Merchandising Company Private Limited,U74899DL1988PTC031996,74.0,1500000
145,145,Allied Blenders And Distillers Private Limited,U15511MH2008PTC187368,,2100000
146,146,Allscripts (India) Private Limited,U72200GJ1998PTC034948,,15000
147,147,Allstate Solutions Private Limited,U74900KA2012FTC064201,,887250
148,148,Alltech Biotechnology Private Limited,U74999KA2001PTC028884,,96000
149,149,Alok International Private Limited,U51109HR2008PTC040042,,1000000
150,150,Alp Nishikawa Company Private Limited,U25190DL1983PTC017070,,2000000
151,151,Alpha Design Technologies Private Limited,U74140KA2003PTC032191,,2225000
152,152,Alpha Plastomers Private Limited,U25209GJ1989PTC011890,,1760000
153,153,Althaf Shoes Private Limited,U18209TN1992PTC023973,18.0,5000000
154,154,Altico Capital India Private Limited,U65993MH2004PTC144260,65.0,376000
155,155,Altruist Technologies Private Limited,U72200HP2005PTC028970,,3440000
156,156,Alufit (India) Private Limited,U27203KA1991PTC012197,,0
157,157,Amadeus Software Labs India Private Limited,U72200KA2012FTC062617,,1500000
158,158,Amalgamations Private Limited,U35999TN1938PTC000019,35.0,5300000
159,159,Amanta Healthcare Limited,U24139GJ1994PLC023944,20.0,0
160,160,Amar Jewellers Ltd,U36911GJ1995PLC024108,,100000
161,161,Amar Prakaash Developerss Private Limited,U70102TN2008PTC066406,,2200000
162,162,Amar Ujala Publications Limited,U22121DL2001PLC159705,58.0,2496000
163,163,Amara Raja Electronics Limited,U31402AP1999PLC032257,31.0,0
164,164,Amara Raja Infra Private Limited,U40102AP2008PTC059398,40.0,3500000
165,165,Amaravathi Textiles Pvt Ltd,U18100AP1983PTC004085,14.0,437000
166,166,Amazon Development Centre (India) Private Limited,U72200KA2004FTC034233,,920900
167,167,Amba River Coke Limited,U23100MH1997PLC110901,19.0,50065
168,168,Ambadi Enterprises Limited,U65991TN1941PLC001437,65.0,1600000
169,169,Ambience Private Limited,U51503DL1986PTC023886,51.0,8200000
170,170,Ambika Cotton Mills Limited,L17115TZ1988PLC002269,17.0,11400000
171,171,Ambit Corporate Finance Private Limited,U65923MH1997PTC109992,64.0,4010000
172,172,Ambit Finvest Private Limited,U65999MH2006PTC163257,,950000
173,173,Ambuja Intermediates Private Limited,U24231GJ1988PTC011091,,540500
174,174,Ambuja Neotia Holdings Private Limited,U65993WB1990PTC049245,65.0,12620833
175,175,Ambuthirtha Power Private Limited,U40101KA2000PTC028247,,1838394
176,176,Amd Industries Limited,L28122DL1983PLC017141,28.0,21000
177,177,Amdd Foods Private Limited,U15400PB2013PTC037911,,0
178,178,Amdipharm Mercury Services Private Limited,U74990MH1999FTC120396,,3426622
179,179,Amer Investments (Delhi) Limited,U74899DL1971PLC005601,74.0,1350000
180,180,Amerigo Realty Private Limited,U70100MH2006PTC159043,70.0,2500000
181,181,Amgoorie India Ltd,U01132AS1977PLC001699,,1195000
182,182,Ami Lifesciences Pvt Ltd,U24110GJ1994PTC021470,,125000
183,183,Ami Organics Private Limited,U24100GJ2007PTC051093,,583000
184,184,Amines And Plasticizers Limited,L24229AS1973PLC001446,20.0,1550000
185,185,Amnet Systems Private Limited,U72300TN2000PTC045280,,4200000
186,186,Amoli Organics Private Limited,U24231GJ1991PTC016288,,752000
187,187,Amphenol Interconnect India Private Limited,U32109MH1970PTC014544,32.0,8421000
188,188,Ample Technologies Private Limited,U51506KA1999PTC025505,,3000000
189,189,Ampo Valves India Private Limited,U29120TZ2009PTC015363,,600000
190,190,Amr India Limited,U45201TG2001PLC036617,,0
191,191,Amr Power Private Limited,U40101KA2004PTC034818,,0
192,192,Amrapali Industries Limited,L91110GJ1988PLC010674,94.0,137700
193,193,Amrit Banaspati Company Limited,U51909UP1985PLC056366,51.0,200000
194,194,Amrit Bottlers Pvt Ltd,U01132WB1983PTC035916,1.0,3600000
195,195,Amrit Feeds Ltd,U15339WB1994PLC064082,,0
196,196,Amrit Petroleums Pvt Ltd,U23201MH1983PTC031175,,1000000
197,197,Amrit Prime Properties Private Limited,U70100MH2005PTC151779,70.0,3000000
198,198,Amrut Distilleries Private Limited,U51101KA1972PTC002246,,0
199,199,Amrutanjan Health Care Limited,L24231TN1936PLC000017,21.0,2500000
200,200,Analog Devices India Private Limited,U85110KA1994PTC016680,,1952855
201,201,Anand Automotive Private Limited,U74999MH1975PTC206199,,1315000
202,202,Anand Azco Infracon India Private Limited,U70100KA2011PTC057154,,50000
203,203,Anand Cy Myutec Automotive Private Limited,,,1860000
204,204,Anand Divine Developers Private Limited,U70101DL2011PTC218192,70.0,1000000
205,205,Andhra Organics Limited,U24116TG1991PLC012314,,0
206,206,Andhra Pradesh Heavy Machinery And Engineering Ltd,U29219AP1976SGC002071,29.0,0
207,207,Andhra Pradesh Power Generation Corporation Limited,U40109TG1998SGC030806,40.0,30780000
208,208,Andrew Yule & Co Ltd,L63090WB1919GOI003229,52.0,740000
209,209,Ani Media Private Limited,U74899DL1971PTC005895,,500000
210,210,Anik Industries Limited,L24118MH1976PLC136836,20.0,250000
211,211,Anil Thermoplastics Private Limited,U25190TN2013PTC093510,,0
212,212,Anish Infracon India Private Limited,U45200GJ2010PTC063391,,2200000
213,213,Anjana Software Solutions Private Limited,U72300TN1999PTC043603,,4700000
214,214,Ankit Gems Private Limited,U36912MH2011PTC216778,36.0,7443333
215,215,Ankit India Limited,L15500WB1981PLC033900,,674913
216,216,Ankur Scientific Energy Technologies Pvt Ltd,U24231GJ1986PTC009039,,1284679
217,217,Ankur Seeds Pvt Ltd,U01110MH1984PTC034560,,6576113
218,218,Anmol Finpro Private Limited,U67120DL1997PTC129068,,311000
219,219,Anmol Industries Private Limited,,,0
220,220,Anna Aluminium Company Private Limited,U27203KL2005PTC018923,27.0,975000
221,221,Annai Infra Developers Private Limited,U40109TZ2008PTC014869,,2200000
222,222,Anritsu India Private Limited,U74900KA2012FTC064808,,250000
223,223,Ansal Buildwell Limited,L45201DL1983PLC017225,45.0,33
224,224,Ansal Housing And Construction Limited,L45201DL1983PLC016821,45.0,10950000
225,225,Ansal Properties And Infrastructure Limited,L45101DL1967PLC004759,45.0,38500000
226,226,Anshul Specialty Molecules Private Limited,U24100MH1971PTC015364,,687479
227,227,Ansys Software Private Limited,U72200PN2001PTC153069,72.0,8468680
228,228,Anthelio Business Technologies Private Limited,U64200TG2007PTC084096,,100000
229,229,Antique Marbonite Private Limited,U24221GJ2003PTC042679,20.0,274871
230,230,Antrix Corporation Limited,U85110KA1992GOI013570,86.0,9028000
231,231,Anu Projects Consultants And Engineers Pvt Ltd,U74140MH1986PTC041595,,16
232,232,Anugraha Valve Castings Limited,U27109TZ1992PLC003873,,3000000
233,233,Anuh Pharma Limited,L24230MH1960PLC011586,21.0,50000
234,234,Anukar Projects Private Limited,U74210TG2002PTC039992,,0
235,235,Anupam Industries Limited,U29199GJ1998PLC034888,,0
236,236,Anupam Rasayan India Limited,U24231GJ2003PLC042988,,5900000
237,237,Anurag Electronics (Gujarat) Pvt Ltd,U32100MH1986PTC041736,,2499870
238,238,Anusaya Auto Press Parts Private Limited,U34300PN1995PTC087102,,744248
239,239,Anvil Fintrade Private Limited,U67120MH1999PTC119170,,2400000
240,240,Anvil Share And Stock Broking Private Limited,U67120MH1997PTC109640,,2200000
241,241,Anwesha Engineering & Projects Limited,U29199GJ1998PLC034128,,2096174
242,242,Apar Industries Limited,L91110GJ1989PLC012802,94.0,11200000
243,243,Aparajitha Corporate Services Private Limited,U74910TN2000PTC046218,,4900000
244,244,Aparna Constructions And Estates Private  Limited,,,15302377
245,245,Aparna Enterprises Limited,U51109TG1994PLC018950,,1980000
246,246,Aparna Infrahousing Private Limited (Part Ix ),U45200TG2006PTC049680,45.0,1800000
247,247,Apax Partners India Advisers Private Limited,U65993MH2006PTC165142,,1000000
248,248,Apcotex Industries Limited,L99999MH1986PLC039199,99.0,957000
249,249,Apeejay Tea Limited,U27108WB1995PLC071253,27.0,2000000
250,250,Apex Agri-Commodities India Private Limited,U51909DL2012PTC245951,,0
251,251,Apm Industries Limited,L21015RJ1973PLC015819,17.0,3245000
252,252,Apollo Earthmovers Limited (Deemed Public Company),U29210GJ1980PLC004064,,2034000
253,253,Apollo Gleneagles Hospital Limited,U33112WB1988PLC045223,33.0,3490000
254,254,Apollo Hospitals Enterprise Limited,L85110TN1979PLC008035,86.0,53640000
255,255,Apollo Hospitals International Limited,U85110TN1997PLC039016,86.0,633795
256,256,Apollo Trading And Finance Private Limited,U74899DL1983PTC015159,,11400000
257,257,Apple Hospitals And Research Institute Limited,U85110MH1994PLC082432,86.0,145300
258,258,Apr Constructions Limited,U45200TG2004PLC044776,45.0,0
259,259,Aptar Pharma India Private Limited,U29195MH1999PTC207807,,221000
260,260,Aptus Value Housing Finance India Limited,U65922TN2009PLC073881,65.0,400000
261,261,Apurva Natvar Parikh & Co Private Limited,U63010MH1959PTC011380,,3508500
262,262,Aquamarine Realty Private Limited,U70100MH2006PTC159053,70.0,2500000
263,263,Aquapharm Chemicals Private Limited,U24231MH1974PTC017243,21.0,2343000
264,264,Aquarelle India Private Limited,U17299KA2007PTC062492,,1650000
265,265,Aradhya Steel Private Limited,U00361KA1989PTC009761,0.0,0
266,266,Aravali Power Company Private Limited,U40105DL2006PTC156884,40.0,37013238
267,267,Arcadis Consulting India Private Limited,U72900KA2009PTC051180,,1240000
268,268,Archean Chemical Industries Private Limited,U24298TN2009PTC072270,24.0,10034000
269,269,Archtech Consultants Pvt Ltd,U74210WB1984PTC038323,,500000
270,270,Arcum Engineering Pvt Ltd,U51505WB1987PTC043521,,2000000
271,271,Ardom Telecom Private Limited,U64100HR2009PTC048269,64.0,0
272,272,Arg Developers Private Limited,U45201RJ2007PTC023820,45.0,1512600
273,273,Ariba Technologies India Private Limited,U72900KA2000PTC027540,,4475898
274,274,Aricent Technologies Private Limited,U72200KA2005PTC035937,,4300000
275,275,Aries Colorchem Private Limited,U24100GJ2009PTC056815,,2100000
276,276,Aries Organics Private Limited,U24117GJ1995PTC024832,,922000
277,277,Arihant Capital Markets Limited,L67120MP1992PLC007182,66.0,200000
278,278,Arihant Industrial Corporation Limited,U45270MH1984PLC034030,,2084929
279,279,Arise Industries And Agency Private Limited,U27310TZ2007PTC013519,,3400000
280,280,Arisglobal Software Private Limited,U72200KA2004PTC033761,,2700000
281,281,Arista Networks India Private Limited,U72200KA2010PTC054455,,1403251
282,282,Arjav Diamonds (India) Private Limited,U36996MH2007PTC169725,36.0,525000
283,283,Arjohuntleigh Healthcare India Private Limited,U85199MH2002PTC135700,85.0,305000
284,284,Arjuna Natural Extracts Ltd,U24239KL1992PLC006670,,3219100
285,285,Arka Carbon Fuels Private Limited,U51102MP2005PTC017307,,0
286,286,Arkay Logistics Limited,U50100MH2004PLC149214,,11500000
287,287,Arkema Peroxides India Private Limited,U24111TN1985PTC011641,20.0,1000000
288,288,Armstrong World Industries (India) Private Limited,U28920MH1999PTC119104,,2599960
289,289,Arohan Financial Services Private Limited,U74140WB1991PTC053189,74.0,1483000
290,290,Aromatic Ingredients Private Limited,U15495KL2005PTC018312,,500000
291,291,Arris India Private Limited,U31901KA2013FTC077805,,818237
292,292,Ars Energy Private Limited,U40100TN1990PTC032178,,800000
293,293,Arthanari Loom Centre Textile Private Limited,U18101TZ1991PTC003485,,1950000
294,294,Arti Properties Private Limited,U45200MH2004PTC146419,45.0,2887244
295,295,Artpalace Export Private Limited,U74900UP2008PTC034467,,2092730
296,296,Arun Textiles Private Limited,U17115TZ1989PTC002372,,0
297,297,Arunachala Logistics Private Limited,U60210TG2000PTC035714,60.0,10306250
298,298,Arvind Brands & Retail Limited,U52609GJ2007PLC051974,52.0,4831
299,299,Arvind Limited,L17119GJ1931PLC000093,17.0,72700000
300,300,Arvind Smartspaces Limited,L45201GJ2008PLC055771,45.0,0
301,301,Arvindbhai Bechardas Jewellers Private Limited,U36911GJ2007PTC050113,,2022300
302,302,Arya Omnitalk Wireless Solutions Private Limited,U31100GJ1995PTC024599,,1513000
303,303,Aryan Exporters Private Limited,U19131DL1975PTC241288,,1100000
304,304,Asahi Songwon Colors Limited (Lucky Laminates),L24222GJ1990PLC014789,20.0,0
305,305,Asap Fluids Private Limited,U74990MH2010PTC200102,,700000
306,306,Asf Insignia Sez Private Limited,U45201DL2005PTC140408,,400000
307,307,Asha Penn Color Private Limited,U24222MH2006PTC163800,,1168355
308,308,Ashapura Arcadia Logistic Private Limited,U63032GJ2006PTC049157,63.0,1000000
309,309,Ashida Electronics Private Limited,U21109MH1994PTC081216,,1271594
310,310,Ashirvad Pipes Private Limited,U85110KA1997PTC021831,86.0,153
311,311,Ashish Infracon Private Limited,U45200GJ2010PTC062372,,1550000
312,312,Ashish Life Science Private Limited,U24100MH1992PTC064810,,2283882
313,313,Ashok Alco-Chem Limited,L24110MH1992PLC069615,20.0,2500000
314,314,Ashoka Buildcon Limited,L45200MH1993PLC071970,45.0,3111000
315,315,Ashoka Concessions Limited,U45201MH2011PLC215760,45.0,200000
316,316,Ashoka Distillers And Chemicals Pvt Ltd,U24119HR1985PTC022672,,2663486
317,317,Ashoka Infraways Limited,U45200MH2001PLC132489,45.0,0
318,318,Asia (Chennai) Engineering Company Private Limited,U45200TN2007PTC064058,,1500000
319,319,Asian Colour Coated Ispat Limited,U27105DL2005PLC132593,,0
320,320,Asian Concretes And Cements Privatelimited,U26940CH2009PTC031641,26.0,1600000
321,321,Asian Fab Tec Limited,U23203KA2000PLC027616,,0
322,322,Asian Fabricx Private Limited,U17100TN2007PTC077807,,0
323,323,Asian Hotels (East) Limited,L15122WB2007PLC162762,15.0,5000000
324,324,Asian Hotels (North) Limited,L55101DL1980PLC011037,55.0,1600000
325,325,Asian Hotels (West) Limited,L55101DL2007PLC157518,55.0,1208000
326,326,Asian Institute Of Nephrology And Urology Private Limited,U85110TG2011PTC074817,85.0,0
327,327,Asianet Communications Limited,U90001MH1991PLC178157,90.0,13550000
328,328,Asirvad Micro Finance Private Limited,U65923TN2007PTC064550,65.0,5595173
329,329,Ask Automotive Private Limited,U34300DL1988PTC030342,,0
330,330,Aska Equipments Limited (Transfered From  Maharashtra),U29222DL1989PLC148198,,1971000
331,331,Asm Technologies Limited,L85110KA1992PLC013421,86.0,2186000
332,332,Aspee Agro Equipment Pvt Ltd,U29219GJ1972PTC002087,29.0,740000
333,333,Assam Edible Oils Limited,U15141RJ1988PLC004255,,1181651
334,334,Assam Gas Company Ltd,U11101AS1962SGC001184,11.0,0
335,335,Assam Petro Chemicals Ltd,L24116AS1971SGC001339,20.0,0
336,336,Asset Reconstruction Company (India) Limited,U65999MH2002PLC134884,65.0,1514630
337,337,Associated Alcohols & Breweries Ltd.,L15520WB1989PLC047211,11.0,0
338,338,Associated Broadcasting Company Private Limited,U92200TG2003PTC040966,,0
339,339,Associated Container Terminals Limited,U21023DL1992PLC148096,,0
340,340,Associated Engineers And Industrials Limited,U29299RJ1978PLC001827,,23000
341,341,Associated Printers (Madras) Private Limited,U22110TN1950PTC000036,22.0,2300000
342,342,Associated Stone Industries (Kotah) Limited,L14101MH1945PLC256122,14.0,4501000
343,343,Astec Lifesciences Limited,L99999MH1994PLC076236,99.0,998945
344,344,Asti Electronics India Private Limited,U32109HR2004PTC035533,,200000
345,345,Astral Poly Technik Limited,L25200GJ1996PLC029134,25.0,18300000
346,346,Atc Tires Private Limited,U25111MH2007PTC172456,25.0,700000
347,347,Athena Infraprojects Private Limited,U40108DL2003PTC120409,40.0,0
348,348,Athenahealth Technology Private Limited,U72200TN2005PTC057276,,1800000
349,349,Atlas Copco (India) Limited,U27106PN1960PLC020566,27.0,1410000
350,350,Atmaja Developers Private Limited,U45209PN2007PTC130923,,1500000
351,351,Atrenta (India) Private Limited,U23201DL2001PTC110958,,1807680
352,352,Ats Elgi Limited,U34300TZ2007PLC014125,34.0,2900000
353,353,Ats Infrastructure Limited,U45201DL1996PLC083475,,8300000
354,354,Au Financiers (India) Limited,U36911RJ1996PLC011381,32.0,23951167
355,355,Au Housing Finance Limited,U65922RJ2011PLC034297,65.0,905660
356,356,Aum Advertising And Media Private Limited,U74300MH2006PTC160578,,2200000
