,Unnamed: 0,name,CIN,NIC,amount
2093,2093,Landmark Cars Private Limited,U50100GJ2006PTC058553,,0
2094,2094,Lapp India Private Limited,U28999KA1996PTC020467,,503555
2095,2095,Laqshya Hyderabad Airport Media Private Limited,U74300MH2007PTC176612,74.0,125000
2096,2096,Lars Medicare Private Limited,U33112DL2005PTC142640,,3300000
2097,2097,Larsen & Toubro Infotech Limited,L99999MH1946PLC004768,99.0,7000000
2098,2098,Latent View Analytics Private Limited,U72300TN2006PTC058481,,2000000
2099,2099,Laurus Labs Limited,U24239AP2005PLC047518,,26650326
2100,2100,Laxmi Diamond Private Limited,U36911MH2006PTC161091,,8900000
2101,2101,Laxmi Publications Private Limited,U22219DL1994PTC063326,,850000
2102,2102,Leap Green Energy Private Limited,U70101TZ2006PTC013130,,0
2103,2103,Learning Mate Solutions Private Limited,U72900MH2003PTC234753,,200000
2104,2104,Leather Crafts (India) Private Limited,U19110TN1979PTC007701,15.0,2600000
2105,2105,Leben Laboratories Private Limited,U24230MH1988PTC048316,,0
2106,2106,Lee Pharma Limited,U24230TG1997PLC028095,,2101000
2107,2107,Leeford Healthcare Limited,U24230PB2006PLC029786,,0
2108,2108,Leena Power-Tech Engineers Private Limited,U31103MH1999PTC118098,,500000
2109,2109,Legris India Private Limited,U74899HR2001PTC048721,,1400000
2110,2110,Lenovo (India) Private Limited,U72900KA2005PTC035783,,0
2111,2111,Levi Strauss (India) Private Limited,U18101KA1994PTC015448,,0
2112,2112,Lexi Private Limited,U36991MH2001PTC131336,,3100000
2113,2113,Lg Polymers India Private Limited,U25203AP1996PTC025917,,2200000
2114,2114,Lg Soft India Private Limited,U85110KA1998PTC023521,,326500
2115,2115,Lgc Promochem India Private Limited,U24230KA1995PTC018443,,810000
2116,2116,Liberty Shoes Limited,L19201HR1986PLC033185,15.0,2271000
2117,2117,Liebherr Machine Tools India Private Limited,U02922KA2003PTC032082,,2850000
2118,2118,Likhami Commercial Co. Ltd,U51109WB1982PLC034623,,2200000
2119,2119,Lincoln Helios (India) Limited,U23200KA1993PLC044269,19.0,4600000
2120,2120,Lincoln Pharmaceuticals Ltd,L24230GJ1995PLC024288,21.0,2910000
2121,2121,Linde Engineering India Private Limited,U64203DL1987PTC029740,64.0,0
2122,2122,Linde India Limited,L40200WB1935PLC008184,40.0,4070000
2123,2123,Link Intime India Private Limited,U67190MH1999PTC118368,,3539776
2124,2124,Link Well Telesystems Pvt Ltd,U64203TG1993PTC015875,,0
2125,2125,Lkp Finance Limited,L65990MH1984PLC032831,65.0,487000
2126,2126,Lloyd Housing Private Limited,U45203DL2006PTC149128,45.0,294583
2127,2127,Lohiya Edible Oils Private Limited,U15141TG2004PTC042431,,0
2128,2128,Lokmangal Agro Industries Limited,U01122PN1998PLC012974,,0
2129,2129,Lona Industries Limited,U24110MH1962PLC012526,,2022000
2130,2130,Lonsen Kiri Chemical Industries Limited,U24114GJ2008PLC053537,,7800000
2131,2131,Lord India Private Limited,U24295MH1985PTC037482,,0
2132,2132,Lotte India Corporation Limited,U15419TN1954PLC001987,10.0,100000
2133,2133,Lotus Wireless Technologies India Private Limited,U32202AP2003PTC041908,,478000
2134,2134,Loyal Textile Mills Limited,L17111TN1946PLC001361,17.0,6300000
2135,2135,Lps Bossard Private Limited,U72200DL1997PTC090805,72.0,3800000
2136,2136,Lt Foods Limited,L74899DL1990PLC041790,74.0,9020000
2137,2137,Lubrizol Advanced Materials India Private Limited,U24297MH1991PTC248032,24.0,750000
2138,2138,Lubrizol India Private Limited,U23201MH1966PTC013538,19.0,13483868
2139,2139,Lucas Tvs Limited,U35999TN1961PLC004678,35.0,1900000
2140,2140,Lucy Electric India Private Limited,U31200MH1994PTC080208,,867000
2141,2141,Ludhiana Beverages Private Limited,U15549PB1994PTC014071,,526000
2142,2142,Ludlow Jute & Specialities Limited,L65993WB1979PLC032394,65.0,0
2143,2143,Lumax Dk Auto Industries Limited,U34300DL1997PLC087110,29.0,1900000
2144,2144,Luna Chemical Industries Private Limited,U24299DL1997PTC090232,,2036693
2145,2145,Lux Industries Limited,L17309WB1995PLC073053,17.0,502000
2146,2146,Lyra Network Private Limited,U72900MH2007PTC175611,,500000
2147,2147,M & B Engineering Limited,,,1575000
2148,2148,M Agarwal Stock Brokers Private Limited,U67120DL1997PTC090524,66.0,781700
2149,2149,M K Agrotech Private Limited,U01514KA1995PTC018144,,2035000
2150,2150,M K U Limited,U19202UP2001PLC026027,,3253612
2151,2151,M. Pallonji Logistics Private Limited,U74999MH2009PTC195037,,11294031
2152,2152,M.P. Agrotonics Limited,U01409MP2003PLC016127,,1816000
2153,2153,M.S. Khurana Engineering Limited,U45201GJ1998PLC034638,,1520000
2154,2154,M3 Investment Private Limited,U65993GJ2005PTC045417,,10100000
2155,2155,Maben Nidhi Limited,U65991KL1993PLC007584,65.0,1513000
2156,2156,Mac Charles (India) Limited,L55101KA1979PLC003620,55.0,4280000
2157,2157,Macbrout Engineering Private Limited,U51505GA2003PTC003311,,1265000
2158,2158,Maco Corporation (India) Private Limited,U36900WB2002PTC094503,,1000000
2159,2159,Macquarie Finance (India) Private Limited,U65999MH2009PTC190863,,3583719
2160,2160,Macro Bars And Wires (India) Pvt Ltd,U27200MH1991PTC062752,,250000
2161,2161,Madhu Jayanti International Ltd,U15491WB1950PLC018768,,6000000
2162,2162,Madhu Silica Private Limited,U24299GJ1987PTC010073,,741
2163,2163,Madhucon Sugar And Power Industries Limited,U15427TG2002PLC039859,,1189000
2164,2164,Madhumita Construction Pvt Ltd,U45200WB1989PTC046596,,5000
2165,2165,Madhur Housing And Development Company(A Pvt Co.With Unlimited Liabili,U74899DL1988ULT031090,74.0,100000
2166,2166,Madhya Gujarat Vij Company Limited,U40102GJ2003SGC042907,40.0,12045304
2167,2167,Madhya Pradesh Agro Food Industries Limited,U15319MP2004PLC016659,,2693500
2168,2168,Madhya Pradesh Power Transmission Company Limited,U40109MP2001SGC014880,40.0,500000
2169,2169,Madhya Pradesh Rajya Van Vikas Nigam Limited,U02001MP1975SGC001341,,1904000
2170,2170,Madhya Pradesh State Civil Suppliescorporation Limited,U15411MP1974SGC001268,10.0,0
2171,2171,Madison Incentives Management Private Limited,U74999TG2011FTC076578,,744800
2172,2172,Madras Christian College,U93090TN1930GAP001579,96.0,5100000
2173,2173,Madras Engineering Industries Private Limited,U35999TN1976PTC007223,35.0,4200000
2174,2174,Maersk Line India Private Limited,U63030MH2011FTC214311,,200000
2175,2175,Magarpatta Township Development And Construction Company Limited,U45201MH1994PLC082257,,2500000
2176,2176,Magma Fincorp Limited,L51504WB1978PLC031813,51.0,1805000
2177,2177,Magna Electro Castings Limited,L31103TZ1990PLC002836,31.0,400000
2178,2178,Magna Projects Pvt Ltd,U45203WB1996PTC077666,,301873
2179,2179,Magneti Marelli Powertrain India Private  Limited,,,272000
2180,2180,Magus Marketing Pvt Ltd,U51909WB1988PTC045097,51.0,600000
2181,2181,Mahabal Metals Privale Limited,U29299MH1996PTC103515,,65750
2182,2182,Mahakoshal Refractories Private Limited,U74999MH2005PTC158200,,77500
2183,2183,Mahalakshmi Infraprojects Limited,U45203PN2000PLC015630,45.0,1400000
2184,2184,Mahalaxmi Infracontract Private Limited,U14200GJ2010PTC060146,,57000
2185,2185,Mahalaxmi Polypack Private Limited,U25202DL2005PTC141640,,0
2186,2186,Maharashtra Airport Development Company Limited,U45203MH2002SGC136979,45.0,0
2187,2187,Maharashtra Eastern Grid Power Transmission Company Limited,U40100GJ2010PLC059593,40.0,14900000
2188,2188,Maharashtra Scooters Ltd,L35912MH1975PLC018376,30.0,1312000
2189,2189,Maharashtra State Power Generation Company Limited,U40100MH2005SGC153648,40.0,62002000
2190,2190,Maharashtra State Seeds Corporation Limited,U01200MH1976SGC018990,1.0,2036714
2191,2191,Mahavir Coal Resources Private Limited,U14200MH2008PTC184905,,0
2192,2192,Mahavir Die Casters Pvt. Ltd.,U29299HR1991PTC031331,,57500
2193,2193,Mahavir Multitrade Private Limited,U51310DL2008PTC183071,,0
2194,2194,Mahavir Synthesis Private Limited,U24110GJ2006PTC047950,,1200000
2195,2195,Mahendra Brothers Exports Private Limited,U52393MH2007PTC169724,52.0,4000
2196,2196,Mahesh Edible Oil Industries Limited,U15143DL2000PLC116763,,3200000
2197,2197,Maheshwari (Thaltej) Complex Private Limited,U45201GJ2002PTC041055,,2800000
2198,2198,Maheshwari Mining Private Limited,U14294WB1994PTC062325,,279240
2199,2199,Mahidhara Chemicals Private Limited,U24110TG1979PTC002421,,1558000
2200,2200,Mahima Fibres Private Limited,U17111MP1998PTC012885,,7914600
2201,2201,Mahima Real Estate Private Limited,U70101RJ1996PTC011675,,2700000
2202,2202,Mahindra And Mahindra Financial Services Limited,L65921MH1991PLC059642,64.0,27435000
2203,2203,Mahindra Bebanco Developers Limited,U45203MH2008PLC183107,45.0,700000
2204,2204,Mahindra Residential Developers Limited,U45200TN2008PLC066292,45.0,4200000
2205,2205,Mahindra Rural Housing Finance Limited,U65922MH2007PLC169791,65.0,9943336
2206,2206,Mahle Behr India Private Limited,U34300PN1997PTC107619,29.0,2600000
2207,2207,Mahle Filter Systems (India) Private Limited,U74899DL1966PTC004919,74.0,3200000
2208,2208,Mainetti (India) Private Limited,U25209TN1997PTC038312,,0
2209,2209,Maini Precision Products Limited,U27201KA1973PLC002307,,1949904
2210,2210,Maithon Power Limited,U74899MH2000PLC267297,,18700000
2211,2211,Majesco Limited,L72300MH2013PLC244874,72.0,500000
2212,2212,Majesco Software And Solutions India Private Limited,U72900GJ2014PTC081103,72.0,500000
2213,2213,Makson Industries Private Limited,U24240MP2003PTC035109,,11000000
2214,2214,Malabar Gold Palace Private Limited,U52393KL2005PTC018265,,6100000
2215,2215,Malabar Jewels And Gems Private Limited,U51398KL2003PTC016082,,8370000
2216,2216,Malco Energy Limited,U31300TN2001PLC069645,31.0,2000000
2217,2217,Malladi Drugs And Pharmaceuticals Limited,U24230TN1980PLC008382,21.0,400000
2218,2218,Man Diesel & Turbo India Private Limited,U74999MH1989FTC050332,,600000
2219,2219,Man Industries (India) Limited,L99999MH1988PLC047408,99.0,1467437
2220,2220,Man Structurals Private Limited,U27107RJ1970PTC001305,27.0,1385500
2221,2221,Man Trucks India Private Limited,U34102PN2006PTC022147,,0
2222,2222,Man Turbomachinery India Private Limited,U02813KA2002PTC030573,,0
2223,2223,Manaksia Limited,L74950WB1984PLC038336,82.0,250000
2224,2224,Manali Petrochemicals Limited,L24294TN1986PLC013087,24.0,500000
2225,2225,Manappuram Finance Limited,L65910KL1992PLC006623,64.0,136677103
2226,2226,Manappuram Jewellers Limited.,U36911KL2008PLC023438,36.0,0
2227,2227,Manchukonda Prakasham Industries India Private Limited,U45201TG2008PTC062299,,2200000
2228,2228,Mandovi Motors Private Limited,U34300KA1999PTC024799,,738148
2229,2229,Mangal Keshav Securities Limited,U65990MH2005PLC154505,65.0,12650000
2230,2230,Mangal Tirth Estate Limited,U70101TN1989PLC017386,,1500000
2231,2231,Mangalam Cement Ltd,L26943RJ1976PLC001705,23.0,20478000
2232,2232,Mangalam Fashions Limited,U18101WB2001PLC092764,,3000000
2233,2233,Mangalore Electricity Supply Company Limited,U40109KA2002SGC030425,40.0,1822847
2234,2234,Mangalore Minerals Private Limited,U10100KA1987PTC008319,,147193
2235,2235,Manglam Build-Developers Limited,U45201RJ2008PLC026256,,5900000
2236,2236,Manhattan Associates (India) Development  Centre Pvt Ltd Isc,,,5822252
2237,2237,Manik Chand And Sons (Jewellers) Private  Limited,,,800000
2238,2238,Manipal Global Education Services Private Limited,U74140KA2001PTC029678,74.0,5700000
2239,2239,Manipal Integrated Services Private Limited,U74140KA2004PTC033168,74.0,0
2240,2240,Manipal Technologies Limited,U22219KA2000PLC026222,,411210
2241,2241,Manish Packaging Private Limited,U25209GJ1997PTC031603,,3947000
2242,2242,Manisha Projects Private Limited,U74899DL1998PTC093085,,0
2243,2243,Manpasand Beverages Limited,L15549GJ2010PLC063283,15.0,4318000
2244,2244,Manpowergroup Services India Private Limited,U74910DL1997PTC085591,,203000
2245,2245,Mapsko Builders Private Limited,U45203DL2003PTC118590,,6200000
2246,2246,Maquet Medical India Private Limited,U33110MH2004PTC144317,,800000
2247,2247,Maral Overseas Limited,L17124MP1989PLC008255,13.0,4831000
2248,2248,Marathwada Auto Compo Private Limited,U29130MH1988PTC046951,29.0,296000
2249,2249,Marck Remedies Private Limited,U99999GJ1993PTC019724,,0
2250,2250,Marco Infrastructure Holdings Private Limited,U45201GJ2007PTC065729,,1300000
2251,2251,Margadarsi Chit Fund Private Limited,U65992AP1962PTC000927,,7000000
2252,2252,Margadarsi Chits (Karnataka) Private Limited,U65992KA2001PTC028802,,1500000
2253,2253,Margadarsi Chits Private Limited,U65991TN1993PTC025267,,1252675
2254,2254,Marico Limited,L15140MH1988PLC049208,10.0,19700000
2255,2255,Maritime Services Private Limited,U63040MH1963PTC012685,,500000
2256,2256,Mark Exhaust Systems Limited,U32204DL1993PLC055905,32.0,0
2257,2257,Marketing Communication & Advertising Limited,U51101KA1972PLC002242,51.0,898000
2258,2258,Marketopper Securities Private Limited,U74140HR2000PTC037694,74.0,1000000
2259,2259,Marks And Spencer (India) Private Limited,U51909HR2005PTC058682,,1386158
2260,2260,Marquis Technologies Private Limited,U74999MH2008PTC184709,,2500000
2261,2261,Martin And Harris Laboratories Limited,U24239HR1993PLC033630,,15000000
2262,2262,Martin Fabrics And Traders Private Limited,U17125TZ2010PTC016109,,1200000
2263,2263,Martin Spinning Mills And Agencies Private Limited,U17111TZ2008PTC014905,,1800000
2264,2264,Marubeni India Private Limited,U74899DL1996PTC079036,74.0,2300000
2265,2265,Maruti Suzuki India Limited,L34103DL1981PLC011375,29.0,5700000
2266,2266,Marveledge Realtors Private Limited,U70101PN2008PTC131638,,0
2267,2267,Marwadi Commodity Broker Private Limited,U74992GJ2001PTC040221,,350000
2268,2268,Mashobra Resort Limited,U55101HP1995PLC017440,55.0,2028534
2269,2269,Mastana Foods Private Limited,U15319DL1999PTC098638,,1489921
2270,2270,Mastercard Mobile Transactions Solutions  Private Limited,U72200PN2005PTC165613,,1195081
2271,2271,Mathrubhumi Printing And Publishing Co Ltd,U22110KL1922PLC001522,22.0,1599000
2272,2272,Matrix Business Services India Private Limited,U74140TN2003PTC051482,,400000
2273,2273,Matrix Cellular (International) Services  Limited,,,2100000
2274,2274,Matrix Clothing Private Limited,U74899HR1977PTC037242,74.0,540000
2275,2275,Matrix Comsec Private Limited,U72200GJ1998PTC034047,,1301000
2276,2276,Matrix India Entertainment Consultants Private Limited,,,2000000
2277,2277,Matrix Publicities And Media Indiaprivate Limited,U74300MH2002PTC137744,73.0,1200000
2278,2278,Maverick Holdings & Investments Private Limited,U65993KA1991PTC036542,,825000
2279,2279,Mavin Switchgears And Control Private Limited,U26960MH2012PTC238334,,0
2280,2280,Max Life Insurance Company Limited,U74899PB2000PLC045626,,200000
2281,2281,Max Spare Limited,U32109MH1967PLC013711,32.0,0
2282,2282,Mayur Uniquoters Limited,L18101RJ1992PLC006952,14.0,7001000
2283,2283,Mazagon Dock Shipbuilders Limited,U35100MH1934GOI002079,35.0,12903002
2284,2284,Mbl Infrastructures Limited,L27109WB1995PLC073700,27.0,998000
2285,2285,Mcafee Software (India) Private Limited,U72400KA2001FTC029764,,13203897
2286,2286,Mcarbon Tech Innovation Private Limited,U64202DL2008PTC176136,,1500000
2287,2287,Mcgraw Hill Education (India) Private Limited,U22200TN1970PTC111531,,200000
2288,2288,Mclube Asia Private Limited,U24100MH2002PTC137775,,164000
2289,2289,Mcs Trading Company Private Limited,U51101MP2004PTC016865,,95277
2290,2290,Mdindia Health Insurance Tpa Private Limited,,,437418
2291,2291,Mecaplast India Private Limited,U74999TN2005FTC080198,,700000
2292,2292,Mecc Alte India Private Limited,U31101PN2006PTC129781,,515000
2293,2293,Mecgale Pneumatics Private Limited,U74999MH2003PTC139205,,701340
2294,2294,Mecon Limited,U74140JH1973GOI001199,74.0,2904000
2295,2295,Med Manor Organics Private Limited,U24232TG2001PTC036559,,1000000
2296,2296,Med-El India Private Limited,U33112DL2006FTC155131,,200000
2297,2297,Medhaj Techno Concept Private Limited,U14292UP2007PTC033550,,1477000
2298,2298,Medi Assist Insurance Tpa Private Limited,,,2993748
2299,2299,Medi Plus (India) Limited,U74899DL1994PLC063407,,2200000
2300,2300,Media.Net Software Services (India) Private Limited,U72300MH2011PTC223273,,2394000
2301,2301,Mediaedge Cia India Private Limited,U74300MH1998PTC154352,73.0,889956
2302,2302,Medicare Environmental Management Private Limited,U24117AP1997PTC026555,,1150000
2303,2303,Medihauxe International Private Limited,U24233TN2009PTC073062,,400000
2304,2304,Medoc Premises Private Limited,U70100MH2006PTC159005,70.0,2500000
2305,2305,Meenakshi Mercantiles Ltd,L67120WB1985PLC120157,66.0,3570000
2306,2306,Meenakshi Narayanan Investments Private Limited,U24112TN1974PTC006766,,500000
2307,2307,Meenakshi Power Private Limited,U40109TG1999PTC031814,,3478545
2308,2308,Megha Engineering & Infrastructures Limited,U45202TG2006PLC050271,,0
2309,2309,Meghmani Organics Limited,L24110GJ1995PLC024052,20.0,7000000
2310,2310,Mehru Electrical And Mechanical Engineers Private Limited,U29299RJ1995PTC010898,,350000
2311,2311,Mehul Construction Company Pvt Ltd,U45202MH1985PTC037560,,0
2312,2312,Menon Bearings Limited,L29130PN1991PLC062352,29.0,4052000
2313,2313,Menzies Aviation Bobba (Bangalore) Private Limited,U63013KA2006PTC039761,,8591000
2314,2314,Mepco Industries Limited,U36911TN1987PLC014168,32.0,2109000
2315,2315,Mercedes-Benz India Private Limited,U34102PN1994PTC083160,,37000000
2316,2316,Mercedes-Benz Research And Development India Private Limited,U73100KA1996PTC021375,,2983386
2317,2317,Merchant Shipping Services Private Limited,U61000MH1996PTC104246,,1919000
2318,2318,Meriton Infotech Pvt Ltd,U72200MH2005PTC270979,,511000
2319,2319,Merittrac Services Private Limited,U74140KA2000PTC027573,74.0,2300000
2320,2320,Merlin Projects Ltd.,U70109WB1984PLC038040,68.0,1614000
2321,2321,Meso Private Limited,U15140MH1992PTC068508,,1250000
2322,2322,Messe Frankfurt Trade Fairs India Private Limited,U74999MH1998PTC114141,,1915000
2323,2323,Messer Cutting Systems India Private Limited,U29220TZ2008FTC014203,,300000
2324,2324,Metacube Software Private Limited,U72200RJ2004PTC019247,,3502900
2325,2325,Metallizing Equipment Company Private Limited,U40100RJ1975PTC001631,,2851000
2326,2326,Metalman Auto Private Limited,U34103PB2000PTC023231,,3600000
2327,2327,Metalyst Forgings Limited,L28910MH1977PLC019569,25.0,0
2328,2328,Metenere Limited,U27107DL1997PLC084906,,0
2329,2329,Methodex Systems Private Limited,U74140DL1974PTC007280,,1600000
2330,2330,Metkore Alloys & Industries Limited,L27101AP2006PLC049591,27.0,1953040
2331,2331,Metlife Global Operations Support Center  Private Limited,,,6643400
2332,2332,Metlloy Trading Services Private Limited,U51909DL2004PTC125629,,3500000
2333,2333,Metricstream Infotech (India) Private Limited,U72200KA2001PTC038330,,0
2334,2334,Metro Global Business Services Private Limited,U74900PN2011PTC138620,,1895976
2335,2335,Metro Medical Services Limited,U24232DL1988PLC184955,,1484807
2336,2336,Metro Speciality Hospitals Private Limited,U85110DL2003PTC118254,,3623457
2337,2337,Metroglobal Limited,L21010MH1992PLC069527,17.0,4354000
2338,2338,Metrohm India Limited,U29130TN1997PLC037666,,5620000
2339,2339,Metropolitan Eximchem Private Limited,U19202MH1968PTC014067,,500000
2340,2340,Mfar Developers Private Limited,U45202KA2008PTC047083,,4075000
2341,2341,Mhaiskar Infrastructure Private Limited,U45200MH2004PTC144258,45.0,25000000
2342,2342,Mi Mysolar24 Private Limited,U40106DL2009PTC195090,,1200000
2343,2343,Micro Housing Finance Corporation Limited,U67190MH2008PLC182274,67.0,128000
2344,2344,Micro Plastics Private Limited,U19201KA1994PTC015731,,2335000
2345,2345,Microchip Technology (India) Private Limited,U72200KA2000PTC026229,,1788492
2346,2346,Microland Limited,U85110KA1989PLC014450,86.0,10000000
2347,2347,Micromatic Machine Tools Private Ltd,U74899DL1987PTC029798,74.0,400000
2348,2348,Micromax Informatics Limited,U00000DL2000PLC104823,0.0,0
2349,2349,Micron Instruments Private Limited,U75231DL1979PTC009658,84.0,1220000
2350,2350,Micropack Private Limited,U52520TG1991PTC013493,,0
2351,2351,Microsemi Storage Solutions India Private Limited,,,0
2352,2352,Microsoft Global Services Center (India)  Private Limited,,,300000
2353,2353,Microsoft India (R&D;) Private Limited,U72200DL1998PTC093824,72.0,19490688
2354,2354,Microsoft Research Lab India Private Limited,U73100DL2004PTC129754,72.0,4429016
2355,2355,Microworld Software Services Private Limited,U72200MH2000PTC127055,,350000
2356,2356,Midas Treads (India) Private Limited,U25199KL1997PTC024585,25.0,0
2357,2357,Milan Laboratories (India) Private Limited,U24230MH2003PTC139736,,1200000
2358,2358,Mili Consultants And Investment Pvt Ltd,U74140MH1987PTC042137,74.0,2000000
2359,2359,Milk Food Aids Private Limited,U15499RJ1984PTC002945,,500000
2360,2360,Milliman India Private Limited,U74140DL2005PTC141854,,614000
2361,2361,Minakshi Cotton Private Limited,U17121MH2008PTC183239,,0
2362,2362,Minda Corporation Limited,L74899DL1985PLC020401,74.0,61752
2363,2363,Minda Industries Limited,L74899DL1992PLC050333,74.0,1035000
2364,2364,Minda Investments Limited,U74899DL1994PLC063761,74.0,1525000
2365,2365,Minda Sai Limited,U31905DL1981PLC127345,31.0,6800000
2366,2366,Minda Vast Access Systems Private Limited,U34300DL2007PTC157344,34.0,35000
2367,2367,Mindstix Software Labs Private Limited,U72900MH2011PTC215346,,1000000
2368,2368,Mindteck (India) Limited,L30007KA1991PLC039702,30.0,2750000
2369,2369,Minera Steel & Power Private Limited,U27101KA2006PTC038481,27.0,1613614
2370,2370,Minex Metallurgical Company Limited,U28910MH1981PLC024161,25.0,760000
2371,2371,Minix Holdings Private Limited,U65990GJ1999PTC035944,,6800000
2372,2372,Mink Tradecom Private Limited,U51502GJ2000PTC038388,,0
2373,2373,Mint Investments Ltd,L15142WB1974PLC029184,10.0,700000
2374,2374,Miot Hospitals Private Limited,U85110TN1994PTC026791,,500000
2375,2375,Miraj Business Development Private Limited,U74140RJ2009PTC030449,,746603
2376,2376,Miraj Products Private Limited,U51909RJ1996PTC012568,,5103132
2377,2377,Miramed Ajuba Solutions Private Limited,,,0
2378,2378,Mistral Solutions Private Limited,U72200KA1999PTC025232,72.0,782500
2379,2379,Misys Software Solutions (India) Private  Limited,,,0
2380,2380,Mita India Private Limited,U74900DL1998PTC097247,,1000000
2381,2381,Mitcon Consultancy & Engineering Services Limited,L74140PN1982PLC026933,74.0,982200
2382,2382,Mitsubishi Elevator India Private Limited,U29300TN2012PTC087354,29.0,3000000
2383,2383,Mitsubishi Heavy Industries-Vst Diesel Engines Private Limited,U34107KA2007PTC043432,34.0,1520086
2384,2384,Mitsubishi Hitachi Power Systems India Private Limited,U29292DL2011FTC225628,29.0,924550
2385,2385,Mitsui O S K Lines (India) Private Limited,U63010MH2002PTC135216,,200000
2386,2386,Mittal Appliances Limited,U28122MH1985PLC174619,,1261884
2387,2387,Mitutoyo South Asia Private Limited,U29299DL1996PTC081425,,2000000
2388,2388,Mixon Holdings Private Limited,U65990GJ1999PTC035945,,4200000
2389,2389,Mk Profinlease Private Limited,U65993MH2006PTC163559,65.0,1600000
2390,2390,Ml Infoway Projects Private Limited,U17230AP1982PTC003480,,1975000
2391,2391,Mmc Infotech Services Private Limited,U72300TN1995PTC031589,,1400000
2392,2392,Mmp Industries Limited,U32300MH1973PLC030813,,200000
2393,2393,Mmtc - Pamp India Private Limited,U27310HR2008PTC042218,27.0,18756657
2394,2394,Mobile2Win India Private Limited,U51395MH2003PTC142173,51.0,1360000
2395,2395,Mobileum (India) Private Limited,U72100MH2000PTC125761,,1325000
2396,2396,Mobis India Limited,U50300TN2005PLC056533,,0
2397,2397,Mobisoft Telesolutions Private Limited,U72200DL1994PTC181176,,1050000
2398,2398,Modern India Con Cast Ltd,U27106WB1987PLC042166,,0
2399,2399,Modern India Limited,L17120MH1933PLC002031,13.0,376250
2400,2400,Modern Road Makers P Ltd,U45203MH1994PTC077075,45.0,55200000
2401,2401,Moet Hennessy India Private Limited,U74899MH2001PTC214367,,5514695
2402,2402,Mohan Spintex India Limited,U18100AP2005PLC046188,18.0,1882939
2403,2403,Mohindra Fasteners Limited,L74899DL1995PLC064215,74.0,1260000
2404,2404,Mokama - Munger Highway Limited,U45200TG2010PLC068804,45.0,0
2405,2405,Mol Information Processing Services (India) Private Limited,U72900MH2004PTC148790,,1353639
2406,2406,Mold-Tek Packaging Limited,L21022TG1997PLC026542,,4110705
2407,2407,Mold-Tek Technologies Limited,L25200TG1985PLC005631,,549944
2408,2408,Molecular Connections Private Limited,U73200KA2001PTC029092,72.0,5500001
2409,2409,Momentive Performance Materials (India) Private Limited,U24299KA1995PTC019244,,8322065
2410,2410,Moneywise Financial Services Private Limited,U51909WB1996PTC078352,51.0,300000
2411,2411,Monga Strayfield Private Limited,U22106PN1968PTC133908,,500000
2412,2412,Mono Steel (India) Limited,U27106MH1992PLC065934,,227000
2413,2413,Monotech Systems Limited,U22219TN1999PLC042840,,0
2414,2414,Monte Carlo Fashions Limited,L51494PB2008PLC032059,51.0,1159488
2415,2415,MoodyS Analytics Knowledge Services (India) Private Limited,,,3762924
2416,2416,Moog India Technology Center Private Limited,U72200KA2010FTC052518,,2750000
2417,2417,Moog Motion Controls Private Limited,U05149KA2003PTC031507,,800000
2418,2418,Moolchand Healthcare Private Limited,U24231DL2006PTC144350,24.0,3661057
2419,2419,Morgan Stanley India Company Private Limited,U22990MH1998PTC115305,,200000
2420,2420,Morgan Stanley India Primary Dealer Private Limited,U67120MH2007PTC174714,,11500000
2421,2421,Morgan Stanley Solutions India Private Limited,U72200MH2003PTC143386,,1740000
2422,2422,Morganite Crucible (India) Limited,L26920MH1986PLC038607,23.0,434205
2423,2423,Motherson Sumi Systems Limited,L34300DL1986PLC026431,29.0,20000000
2424,2424,Motif India Infotech Private Limited,U72200GJ2000PTC037637,,2526009
2425,2425,Motilal Oswal Commodities Broker Private  Limited,,,600000
2426,2426,Motilal Oswal Financial Services Limited,L67190MH2005PLC153397,67.0,4730000
2427,2427,Motilal Oswal Securities Limited,U65990MH1994PLC079418,65.0,5400000
2428,2428,Motorola Mobility India Private Limited,U32204HR2009PTC039313,,3980967
2429,2429,Motorola Solutions India Private Limited,U32109HR1989PTC034131,,1000000
2430,2430,Mount Everest Breweries Limited,U15549WB1999PLC090059,,0
2431,2431,Mouri Tech Private Limited,U72200TG2005PTC048486,,302304
2432,2432,Mp Online Limited,U72400MP2006PLC018777,72.0,4000000
