,Unnamed: 0,name,CIN,NIC,amount
1063,1063,Emami Paper Mills Limited,L21019WB1981PLC034161,17.0,17729000
1064,1064,Emas Expressway Private Limited,U45203WB2002PTC094381,,321823
1065,1065,Embio Limited,U24110MH1986PLC038680,20.0,2065000
1066,1066,Emco Goa Private Limited,U13209GA1965PTC000046,,293000
1067,1067,Emco Limited,L31102MH1964PLC013011,31.0,1202000
1068,1068,Emcure Pharmaceuticals Limited,U24231PN1981PLC024251,21.0,37800000
1069,1069,Emerald Cars Private Limited,U50102GJ2006PTC049383,,591750
1070,1070,Emerald Haven Realty Limited,U45200TN2010PLC075953,45.0,58600000
1071,1071,Emerald Jewel Industry India Limited,U03691TZ2004PLC011255,3.0,300000
1072,1072,Emerson Process Management (India) Private Limited,U29196MH1981PTC024115,29.0,2400000
1073,1073,Emerson Process Management Power And Water Solutions India Private Limited,U40109DL1997FTC085582,40.0,200000
1074,1074,Emids Technologies Private Limited,U85110KA1999PTC024738,,3530979
1075,1075,Eminence Equipments Private Limited,U29299PN2005PTC020672,,1300000
1076,1076,Emmbros Autocomp Limited,U34300HP1991PLC011005,29.0,100000
1077,1077,Emmennar Pharma Private Limited,U24299TG2002PTC039653,,100000
1078,1078,Emmvee Photovoltaic Power Private Limited,U26101KA2007PTC042197,,3828917
1079,1079,Empee Distilleries Limited,L15511TN1983PLC010313,11.0,2100000
1080,1080,Emtici Engineering Limited,U29259GJ1956PLC001509,29.0,1159000
1081,1081,Enam Asset Management Company Private Lmited,U65991MH1997PTC111056,65.0,1426000
1082,1082,Encardio Rite Electronics Private Limited,U32109UP1966PTC003122,,600000
1083,1083,Encarta Pharma Private Limited,U51397KA2001PTC029717,,353547
1084,1084,Encee Aromatics Private Limited,U01122TZ1978PTC000805,,300000
1085,1085,Enco Engineers Combine (Plant Ii) Private Limited,U29308DL2005PTC141740,,5645757
1086,1086,Enco Engineers Combine Private Limited,U29191DL1996PTC079115,,500000
1087,1087,Encompass Events Pvt. Ltd.,U92199DL1999PTC101253,93.0,800000
1088,1088,Encore Natural Polymers Private Limited,U24230MH1991PTC063720,21.0,3850000
1089,1089,Encube Ethicals Private Limited,U24230MH1995PTC092485,,13500000
1090,1090,Endemol India Private Limited,U92100MH2006PTC158644,,1500000
1091,1091,Endress + Hauser Flowtec (India) Private  Limited,,,1332976
1092,1092,Endress And Hauser (India) Automationinstrumentation Private Limited,U74900MH2007PTC170990,,1100000
1093,1093,Engineering And Agencies Pvt Ltd,U51109MH1946PTC005235,51.0,1700000
1094,1094,Engineering Projects (India) Limited,U27109DL1970GOI117585,27.0,0
1095,1095,Enpro Industries Private Limited,U74210PN1999PTC013421,,342000
1096,1096,Enrich Agro Food Products Private Ltd,U01119DL1984PTC019569,,1900000
1097,1097,Ensure Support Services (India) Limited,U72900TN2013PLC091888,,700000
1098,1098,Enter 10 Television Private Limited,U51102MP1998PTC012813,,500000
1099,1099,Entertainment Network (India) Limited,L92140MH1999PLC120516,90.0,20100000
1100,1100,Enventure Technology Services India Private Limited,U72900KA2009PTC049665,,412520
1101,1101,Envestnet Asset Management India Private Limited,U72200KL2001PTC015113,,259499
1102,1102,Enviro Control Associates (India) Private Limited,U45202GJ2001PTC039311,,7600000
1103,1103,Eppendorf India Limited,U51505TN2003PLC050655,,1450000
1104,1104,Epsillon Real Estate Private Limited,U70102KA2007PTC043539,,0
1105,1105,Epsilon Carbon Private Limited,U24100MH2010PTC207156,24.0,1350000
1106,1106,Epsilon Ventures Private Limited,U70101KA1994PTC016635,,771500
1107,1107,Equiniti India Private Limited,U72200TN2005PTC055228,,100000
1108,1108,Equitas Finance Limited,U65191TN1993PLC025280,64.0,20600000
1109,1109,Equitas Holdings Limited,U65100TN2007PLC064069,65.0,1200000
1110,1110,Equitas Micro Finance Limited,U65993TN1994PLC028002,65.0,32094489
1111,1111,Eris Lifesciences Private Limited,U24232GJ2007PTC049867,24.0,0
1112,1112,Erudite Eduventures Private Limited,U72900MH2002PTC138168,,1925000
1113,1113,Eruditus Education Private Limited,U80902TN2010PTC077828,,420000
1114,1114,Esab India Limited,L29299TN1987PLC058738,29.0,1105000
1115,1115,Escorts Limited,L74899HR1944PLC039088,74.0,6800000
1116,1116,Esdee Paints Limited,U24222MH1979PLC021670,,10299000
1117,1117,Ess Kay Auto Finance Private Limited,U65923RJ1994PTC009051,64.0,561000
1118,1118,Essae -Teraoka Private Limited,U85110KA1986PTC007560,,5900000
1119,1119,Essae Digitronics Private Limited,U31101KA1996PTC019747,31.0,650000
1120,1120,Essar Bulk Terminal Paradip Limited,U63000GJ2009PLC058496,63.0,5000000
1121,1121,Essen Multipack Limited,U25209GJ1994PLC022139,,1383805
1122,1122,Eta Karnataka Estates Limited,U18101TN1996PLC036220,,0
1123,1123,Etisalat Software Solutions Private Limited,U72200KA2007PTC042080,,2000000
1124,1124,Etouch Systems (India) Private Limited,U72900MH2008PTC178764,,2118601
1125,1125,Eureka Stock & Share Broking Services Limited,U70109WB1992PLC055782,68.0,0
1126,1126,Euro Footwear Private Limited,U19201UP2000PTC025269,,1075000
1127,1127,Eurofins It Solutions India Private Limited,U72200KA2012FTC062653,,200000
1128,1128,Eurokids International Private Limited,U22120MH1993PTC075091,58.0,1395681
1129,1129,Eveready Industries India Ltd,L31402WB1934PLC007993,31.0,158000
1130,1130,Everest Tannery Private Limited,U18201UP1993PTC015719,,0
1131,1131,Evolution Realty Private Limited,U45200DL2007PTC157412,,0
1132,1132,Excel Controlinkage Private Limited,U29130MH1994PTC077836,,335000
1133,1133,Excel Crop Care Ltd,L74999MH1964PLC012878,74.0,12185000
1134,1134,Excel Industries Limited,L24200MH1960PLC011807,24.0,5169000
1135,1135,Excel Pack Private Limited,U21029DL1999PTC100494,,1200000
1136,1136,Exel Rubber Limited,U25199TG1987PLC008050,,100000
1137,1137,Exevo India Private Limited,U72900DL2002PTC114695,72.0,1075000
1138,1138,Exfo Electro-Optical Engineering India Private Limited,U72900PN2006PTC129263,,303527
1139,1139,Exide Industries Limited,L31402WB1947PLC014919,31.0,400000
1140,1140,Exide Life Insurance Company Limited,U66010KA2000PLC028273,66.0,1500000
1141,1141,Exl Service.Com(India) Private Limited,U72200DL1999PTC099888,,3600000
1142,1142,Exotica Housing & Infrastructure Projects Private Limited,U70101DL2010PTC204179,,227311
1143,1143,Experis It Private Limited,U72900WB1997PTC085392,,5300000
1144,1144,Express Global Logistics Private Limited,U63090MH1946PTC004733,52.0,10000
1145,1145,Express Infrastructure Private Limited,U45203TN2005PTC058307,45.0,1700000
1146,1146,Express Newspapers Private Limited,U70101TN1956PTC003445,68.0,6600000
1147,1147,Extreme Networks India Private Limited,U72100TN2004PTC054682,,700000
1148,1148,Eye Foundation Limited,U03311TZ1997PLC011249,,1800000
1149,1149,Eygbs (India) Private Limited,U74140KA2006PTC040620,,7673600
1150,1150,Fabindia Overseas Private Limited,U74899DL1976PTC008436,74.0,1000000
1151,1151,Facilities And Building Solutions Private Limited,U74140KA2005PTC035529,,3556310
1152,1152,Fainger Leser Valves Pvt Ltd,U28993MH1987PTC044616,,300000
1153,1153,Fairchem Speciality Limited,L15140MH1985PLC286828,,22220
1154,1154,Faiveley Transport Rail Technologies India Limited,U29199TZ1991PLC008636,,700000
1155,1155,Falcon Pumps Private Limited,U55101GJ1997PTC032360,,16730
1156,1156,Fanuc India Private Limited,U29221KA1991PTC015413,,14060270
1157,1157,Farida Classic Shoes Private Limited,U18209TN1981PTC008805,18.0,100000
1158,1158,Farida Shoes Private Limited,U19119TN1976PTC007207,15.0,2300000
1159,1159,Farmson Pharmaceutical Gujarat Private Limited,U24230GJ1974PTC002467,,0
1160,1160,Fashion Suitings Private Limited,U18108RJ1988PTC004383,,1298262
1161,1161,Fast Movers Logistics Private Limited,U63090DL2011PTC218011,,1480000
1162,1162,Faurecia Emissions Control Technologies India Private Limited,U29130TN1997FTC037962,29.0,1000000
1163,1163,Faurecia Interior Systems India Private Limited,U34300PN2004PTC019215,,230210
1164,1164,Fci Aravali Gypsum And Minerals India Limited,U14105RJ2003GOI018093,14.0,6217245
1165,1165,Fci Oen Connectors Limited,U32104KL1981PLC003348,32.0,241900
1166,1166,Fdc Limited,L24239MH1940PLC003176,21.0,6400000
1167,1167,Federal - Mogul Ignition Products India Limited,U51109DL1998PLC195010,51.0,15
1168,1168,Federal-Mogul Goetze (India) Limited,L74899DL1954PLC002452,74.0,4654000
1169,1169,Federal-Mogul Tpr (India) Limited,U34300DL1997PLC087410,29.0,6743000
1170,1170,Fedex Trade Networks Transport & Brokerage Private Limited,U63090MH2009FTC196652,,400000
1171,1171,Feegrade & Co Pvt Ltd,U10200WB1964PTC026218,10.0,35000
1172,1172,Fena Private Limited,U74899DL1986PTC025829,,2400000
1173,1173,Fernandez Hospital Private Limited,U85110TG1991PTC013233,,350000
1174,1174,Ferolite Jointings Limited.,U36999DL1989PLC038118,,740000
1175,1175,Ferro Alloys Corporation Limited,L45201OR1955PLC008400,45.0,7287000
1176,1176,Ferro Scrap Nigam Limited,U27102CT1989GOI005468,27.0,0
1177,1177,Ferro Tech India Private Limited,U51420OR2007PTC009696,51.0,1146637
1178,1178,Ferromatik Milacron India Private Limited,U74999GJ1995FTC025783,74.0,4000000
1179,1179,Fertilisers And Chemicals Travancore Ltd,L24129KL1943GOI000371,20.0,0
1180,1180,Fette Compacting Machinery India Private Limited,U29297PN2010PTC154150,,608000
1181,1181,Ffv Services Private Limited,U74140DL2011PTC218945,,4000000
1182,1182,Fiem Industries Limited,L36999DL1989PLC034928,36.0,1250000
1183,1183,Fil India Business And Research Services Private Limited,,,600000
1184,1184,Financial Software And Systems Private Limited,U52599TN1991PTC020361,52.0,1100000
1185,1185,Finar Limited,U24231GJ1998PLC034615,,1808000
1186,1186,Finav Gems & Securities Private Limited,U67120MH2001PTC132673,66.0,2175000
1187,1187,Fine Components And Tools Private Limited,U28920KA1997PTC022731,,1350000
1188,1188,Finecure Pharmaceuticals Limited,U24230GJ2005PLC045724,,2887400
1189,1189,Fineotex Chemical Limited,L24100MH2004PLC144295,24.0,400000
1190,1190,Finproject India Private Limited,U24139RJ2010FTC045383,,3034290
1191,1191,Fire Luxur Developers Private Limited,U45202KA2006FTC040314,,200000
1192,1192,First Advantage Global Operating Center Private Limited,U72200KA2000PTC026751,,0
1193,1193,Firstsource Solutions Limited,L64202MH2001PLC134147,64.0,25880000
1194,1194,Fis Payment Solutions & Services India Private Limited,U72200DL2005PTC134488,,2181618
1195,1195,Fis Solutions (India) Private Limited,,,2201070
1196,1196,Fis Solutions Software (India) Private Limited,,,71850
1197,1197,Fiserv India Private Limited,U72900DL2002PTC115630,,9348860
1198,1198,Flagship Realty Private Limited,U45200GJ2006PTC048001,,0
1199,1199,Fleetguard Filters Private Limited,U29197MH1987PTC042672,29.0,280000
1200,1200,Flexituff International Limited,L25202MP1993PLC034616,25.0,1000000
1201,1201,Flextronics Technologies (India) Private  Limited,,,13800000
1202,1202,Flint Group India Private Limited,U02422GJ1989PTC079311,,0
1203,1203,Florence Shoe Company Private Limited,U19129TN1978PTC007584,15.0,0
1204,1204,Flow Link Systems Private Limited,U29120TZ1992PTC003779,29.0,500000
1205,1205,Flsmidth Private Limited,U26941TN2000PTC044765,23.0,6600000
1206,1206,Fluentgrid Limited,U72200AP1998PLC030617,,4075638
1207,1207,Fluor Daniel India Private Limited,U74899DL1995PTC070677,,9416564
1208,1208,Flyjac Logistics Private Limited,U63000MH2008PTC180548,,600000
1209,1209,Fm Pbw Bearings Private Limited,U27101GJ2014PTC078162,,3650000
1210,1210,Fmi Limited,U29222PB1964PLC002568,29.0,300000
1211,1211,Food Ingredient Specialities Private Limited,U52110TN1990PTC018675,,866460
1212,1212,Foods And Inns Limited,L55200MH1967PLC013837,55.0,500000
1213,1213,Forace Polymers Private Limited,U15142UR1980PTC005172,,1200000
1214,1214,Forbes Marshall Arca Private Limited,U29299PN1985PTC038445,29.0,1020172
1215,1215,Force Motors Limited,L34102PN1958PLC011172,29.0,13800000
1216,1216,Ford Motor Private Limited,U74120TN1998PTC041070,,2115795
1217,1217,Forevermark Diamonds Private Limited,U36912MH2008PTC183268,36.0,1000000
1218,1218,Forge And Forge Private Limited,U28910GJ1974PTC002548,,2000000
1219,1219,Formula Corporate Solutions India Private Limited,U74999DL2004PTC124193,,900000
1220,1220,Forstar Frozen Foods Private Limited.,U05000MH1992PTC067511,,1100
1221,1221,Fortuna Engineering Private Limited,U29220MH1989PTC053624,,0
1222,1222,Fortune Gilts Private Limited,U67120GJ2003PTC042121,,284204
1223,1223,Fortune Integrated Assets Finance Limited,U65923MH2012PLC235450,65.0,360000
1224,1224,Fortune Marketing Private Limited,U74899DL1994PTC061991,,2500000
1225,1225,Fortune Metals Limited,U27100PB2004PLC027603,,780792
1226,1226,Fortune Park Hotels Limited,U55101HR1995PLC052281,55.0,1748000
1227,1227,Fosroc Chemicals (India) Private Limited,U02411KA1980PTC004053,,10515078
1228,1228,Fossil India Private Limited,U18101KA2007PTC071705,,313672
1229,1229,Fragomen Immigration Services India Private Limited,U74140KA2006FTC041106,,1000000
1230,1230,Freewill Sports Private Limited,U36939PB1984PTC006013,,308295
1231,1231,Freight Connection India Private Limited,U35110MH1995PTC085229,35.0,1700000
1232,1232,Fresenius Kabi Oncology Limited,U24231DL2003PLC119441,21.0,534300000
1233,1233,Fresenius Medical Care India Private Limited,U24231DL2006FTC147436,,0
1234,1234,Freshtrop Fruits Limited,L15400GJ1992PLC018365,15.0,754157
1235,1235,Freudenberg Performance Materials India Private Limited,U29197TN1998PTC078651,,2000000
1236,1236,Frog Cellsat Limited,U51909DL2004PLC127530,,200000
1237,1237,Frontier Business Systems Private Limited,U67120KA1994PTC016155,,0
1238,1238,Frost International Limited,U05001MH1995PLC243081,5.0,1950000
1239,1239,Fullerton India Credit Company Limited,U65191TN1994PLC079235,64.0,8642616
1240,1240,Fundermax India Private Limited,U36998KA2007PTC059958,,1325636
1241,1241,Fusion Micro Finance Private Limited,U74899DL1994PTC061287,74.0,200000
1242,1242,Futura Bioplants Private Limited,U01122PN2008PTC131951,,600000
1243,1243,Future Financial Servicess Private Limited,U65910KA1996PTC077857,64.0,1183337
1244,1244,Future Focus Infotech Private Limited,U72300TN1997PTC039190,63.0,0
1245,1245,Future Gaming And Hotel Services Private  Limited,,,3600000
1246,1246,G Corp Homes Private Limited,U70102KA2006PTC040256,70.0,1770000
1247,1247,G Corp Private Limited,U70102KA2001PTC028962,68.0,250000
1248,1248,G V G Paper Mills Private Limited,U02101TZ1985PTC006888,,2400000
1249,1249,G.D. Pharmaceuticals Private Limited,U24231WB1955PTC022265,,4819258
1250,1250,G.D.Birla Medical Research And Education Foundation,U80300MH1987GAT042663,,130000
1251,1251,G.K. Winding Wires Limited,U74899DL1985PLC022363,74.0,1600000
1252,1252,G4S Corporate Services (India) Private Limited,U67120DL1996PTC080556,66.0,1100900
1253,1253,Gabriel India Limited,L34101PN1961PLC015735,29.0,12510000
1254,1254,Gacl Finance Private Limited,U65990MH1980PTC023151,,2500000
1255,1255,Gadre Marine Export Pvt Ltd,U51223PN1994PTC078366,,806050
1256,1256,Gagan Ferrotech Limited,U51109WB1993PLC058238,51.0,2291000
1257,1257,Gagandeep Credit Capital Private Limited,U65990MH1993PTC073769,,10000000
1258,1258,Gain Theory Consulting Private Limited,U74300MH2002PTC136461,73.0,970162
1259,1259,Galax E.Solutions India Private Limited,U72900KA2003PTC039683,,100000
1260,1260,Galaxy Avenue Private Limited,U45201GJ2004PTC044255,,900000
1261,1261,Galfar Engineering & Contracting (India) Private Limited,U45200TN2009FTC071390,,0
1262,1262,Gallagher Operations Support Services Private Limited,U72900PN2006PTC128475,,2460000
1263,1263,Game Plan Sports Private Limited,U25201WB2001PTC092853,,1000000
1264,1264,Gandhar Oil Refinery (India) Limited,U23200MH1992PLC068905,19.0,200000
1265,1265,Ganesh Housing Corporation Limited,L45200GJ1991PLC015817,45.0,10411334
1266,1266,Ganesha Ecosphere Limited,L51109UP1987PLC009090,51.0,26100
1267,1267,Ganga Acrowools Ltd,U17117PB1994PLC014190,17.0,281622
1268,1268,Ganga Kaveri Seeds Private Limited,U74899DL1983PTC014946,74.0,2927441
1269,1269,Ganga Medical Centre And Hospitals Private Limited,U40108TZ1994PTC005600,,7800000
1270,1270,Gangakhed Sugar & Energy Limited,U15421MH2007PLC174599,15.0,2400000
1271,1271,Gangamai Industries And Constructions Limited,U15420MH1999PLC119930,,0
1272,1272,Gangavaram Port Limited,U45209TG2001PLC037861,45.0,8529080
1273,1273,Gannon Dunkerley And Company Limited,U51109MH1924PLC001107,51.0,22695000
1274,1274,Ganpati Industrial Pvt Ltd,U51109WB1995PTC072201,51.0,2691000
1275,1275,Ganpati Townships Limited,U70100PB2005PLC028718,70.0,1119170
1276,1276,Gartner India Research & Advisory Services Private Limited,U74140MH1999PTC120535,74.0,9800
1277,1277,Garware Bestretch Limited,U24130MH1994PLC142451,20.0,11335581
1278,1278,Garware Industriees Limited,U74999MH2012PLC235072,74.0,1365000
1279,1279,Garware Polyester Limited,L10889MH1957PLC010889,10.0,1200000
1280,1280,Garware Wall Ropes Limited,L25209MH1976PLC018939,25.0,2500000
1281,1281,Gateway Rail Freight Limited,U60231DL2005PLC138598,60.0,12945280
1282,1282,Gateway Terminals India Private Limited,U45203MH2004PTC147791,45.0,14100000
1283,1283,Gati Limited,L63011TG1995PLC020121,52.0,300000
1284,1284,Gawar Construction Limited.,U70109HR2008PLC037773,,12000000
1285,1285,Gayatrishakti Paper & Boards Limited,U21010MH2005PLC153451,21.0,600000
1286,1286,Gbtl Limited,,,2830000
1287,1287,Ge Be Private Limited,U31909KA1996PTC020482,31.0,4900000
1288,1288,Ge India Business Services Private Limited,U72900DL1999PTC102432,,3100652
1289,1289,Ge Money Financial Services Private Limited,U65929DL1994PTC116256,64.0,9000000
1290,1290,Ge Oil & Gas India Private Limited,,,6100000
1291,1291,Ge Power India Limited,,,1500000
1292,1292,Ge T&D; India Limited,U23201WB2005PTC104467,23.0,5820000
1293,1293,Gea Process Engineering (India) Private Limited,U74999GJ1992PTC078975,,0
1294,1294,Gee Limited,L65990MH1990PLC056669,65.0,1212000
1295,1295,Geltec Private Limited,U24230MH2002PTC135200,21.0,100000
1296,1296,Gem Hospital And Research Centre Private Limited,U85110TZ2000PTC009434,,2100000
1297,1297,General Insurance Corporation Of India,U67200MH1972GOI016133,67.0,47104187
1298,1298,General Mills India Private Limited,U15510MH1995PTC094741,,130000
1299,1299,Genesis Burson -Marsteller Public Relations Private Limited,U74899DL2002PTC114637,,2959230
1300,1300,Gennova Biopharmaceuticals Limited,U24231PN2001PLC016253,21.0,0
1301,1301,Genpact India Private Limited,U73100DL2005PTC307363,,15700000
1302,1302,Genting Lanco Power (India) Private Limited,U40100AP1997PTC044831,40.0,2
1303,1303,Genuine Stock Brokers Private Limited,U67120UP1996PTC044971,,250000
1304,1304,Genus Electrotech Limited,U32109DL2003PLC121435,32.0,12000
1305,1305,Genus Innovation Limited,U51311UR1998PLC001289,51.0,372000
1306,1306,Genus Paper & Boards Limited,L21098UP2012PLC048300,21.0,2287000
1307,1307,Genus Power Infrastructures Limited,L51909UP1992PLC051997,51.0,10101000
1308,1308,Geo Connect Limited,U74899DL1999PLC101065,,1342000
1309,1309,Geometric Limited,L72200MH1994PLC077342,72.0,9810000
1310,1310,George Oakes Limited,U50300TN1956PLC000758,50.0,1000000
1311,1311,Gerb Vibration Control Systems Private Limited,U45202KA1992PTC012905,,500000
1312,1312,Gestamp Automotive Chennai Private Limited,U28112TN2011FTC081706,,0
1313,1313,Gestamp Automotive India Private Limited,U28990PN2008FTC132030,,1482534
1314,1314,Gharda Chemicals Limited,U24110MH1967PLC013688,20.0,13235000
1315,1315,Ghatge Patil Industries Limited,U31103PN1960PLC011738,31.0,2825521
1316,1316,Ghaziabad Precision Products Private Limited,U74899DL1988PTC033153,,1683000
1317,1317,Gina Engineering Company Private Limited,U04520KA1988PTC009201,,450000
1318,1318,Ginni Filaments Limited.,L71200UP1982PLC012550,71.0,5785000
1319,1319,Ginni International Ltd. (Transfer From Delhi To Raj.),U70101RJ1984PLC011217,,2321000
1320,1320,Girnar Food And Beverages Private Limited,U15100MH1987PTC045118,,111000
1321,1321,Gits Food Products Private Limited,U15443MH1994PTC079891,15.0,2187600
1322,1322,Gkb Rx Lens Pvt Ltd,U33201WB1985PTC039759,33.0,12520305
1323,1323,Gkn Driveline (India) Limited,U74999HR1985PLC034079,74.0,868964
1324,1324,Gland Pharma Ltd,U24239AP1978PLC002276,21.0,5000000
1325,1325,Glassco Laboratory Equipments Private Limited,U51909HR2009PTC039648,,616880
1326,1326,Glenmark Pharmaceuticals Limited,L24299MH1977PLC019982,24.0,49740000
1327,1327,Glenworth Estate Limited,U01132TN2005PLC057656,,600000
1328,1328,Global Advertisement Services Private Limited,U74999PN2010PTC135492,,1112295
1329,1329,Global Analytics India Private Limited,U72300TN2003FTC052240,,300000
1330,1330,Global Coal And Mining Private Limited,U10102DL1998PTC094328,10.0,2600000
1331,1331,Global Edge Software Limited,U85110KA1992PLC013114,86.0,1600000
1332,1332,Global Energy Private Limited,U40101GA1994PTC001663,,5000000
1333,1333,Global Information Systems Technology Private Limited,U74899DL1990PTC040480,,1500000
1334,1334,Globally Managed Services India Private Limited,U72900MH2002PTC138306,72.0,1971033
1335,1335,Globant India Private Limited,U72900PN2008PTC131460,,1581096
1336,1336,Globe Fincap Limited.,U67120DL2008PLC176326,67.0,5710000
1337,1337,Globetrotters Educational Innoventions Private Limited,U80302RJ2007PTC023965,,906850
1338,1338,Glochem Industries Limited,U24110TG1995PLC022303,20.0,82500
1339,1339,Glory Global Solutions (South Asia) Private Limited,U67190MH2010PTC208191,,100000
1340,1340,Gmmco Ltd,U35202WB1966PLC026980,35.0,5500000
1341,1341,Gmr Airport Developers Limited,U62200TG2008PLC059646,,1000000
1342,1342,Gmr Gujarat Solar Power Limited,U40100KA2008PLC045783,,11544000
1343,1343,Gmr Hyderabad International Airport Limited,U62100TG2002PLC040118,,275000
1344,1344,Gmr Kamalanga Energy Limited,U40101KA2007PLC044809,40.0,20850000
1345,1345,Gmr Power Corporation Limited,U40105KA1995PLC016942,40.0,15368000
1346,1346,Gmr Warora Energy Limited,U40100MH2005PLC155140,40.0,6404000
1347,1347,Goa Carbon Limited,L23109GA1967PLC000076,19.0,700000
1348,1348,God Gift Properties Private Limited,U74210DL1997PTC086207,74.0,250000
1349,1349,Godawari Power And Ispat Limited,L27106CT1999PLC013756,27.0,38443000
1350,1350,Godfrey Phillips India Limited,L16004MH1936PLC008587,12.0,30396000
1351,1351,Godrej Agrovet Limited,U15410MH1991PLC135359,10.0,1100000
1352,1352,Godrej Consumer Products Limited,L24246MH2000PLC129806,20.0,54800000
1353,1353,Goel Ganga Developers (India) Private Limited,U45200PN2009PTC133430,,1635000
1354,1354,Goel International Private Limited,U51211DL2000PTC106078,,1100000
1355,1355,Gokul Refoils And Solvent Limited,L15142GJ1992PLC018745,10.0,0
1356,1356,Golden Goenka Fincorp Limited,L65993WB1993PLC060377,65.0,1000000
1357,1357,Golden Valley Agrotech Private Limited,U23200GJ2010PTC060954,,1000000
1358,1358,Goldman Sachs (India) Capital Markets Private Limited,U67190MH2009FTC198210,,17600000
1359,1359,Goldman Sachs (India) Finance Private Limited,U67120MH1991PTC063512,,5400000
1360,1360,Goldman Sachs Services Private Limited,U72400KA2003PTC032606,,52400000
1361,1361,Golkunda Diamonds And Jewellery Limited,L36912MH1990PLC058729,32.0,1000000
1362,1362,Goodcare Pharma Pvt Ltd,U24233WB1993PTC057791,,283063
1363,1363,Goodluck India Limited,,,2108000
1364,1364,Goodrich Aerospace Services Private Limited,U85110KA1996PTC021327,,0
1365,1365,Goodyear India Limited,L25111HR1961PLC008578,22.0,12300000
1366,1366,Gopal Snacks Private Limited,U15400GJ2009PTC058781,,0
1367,1367,Govik Electricals Private Limited,U32109MH1990PTC056660,,2500000
1368,1368,Govind Commercial Co Ltd,U65993WB1980PLC032463,,3000000
1369,1369,Gowthami Solvent Oils Limited,U15140AP1974PLC001699,,671061
1370,1370,Goyal And Co (Constructions)Pvt Ltd,U45201GJ1988PTC010799,,2000000
1371,1371,Goyal Proteins Limited,U24117RJ1999PLC015695,,2515060
1372,1372,Gp Global Asphalt Private Limited,U11100DL2011PTC216988,11.0,4886153
1373,1373,Gpt Infraprojects Limited,L20103WB1980PLC032872,16.0,908821
1374,1374,Grace Davison Chemicals India Private Limited,U24118MH1995PTC085349,,1500000
1375,1375,Grainotch Industries Limited,U15549MH2006PLC165848,,30000
1376,1376,Grama Vidiyal Micro Finance Limited,U65929TN2003PLC050856,64.0,3000000
1377,1377,Grameen Koota Financial Services Private Limited,U51216KA1991PTC053425,51.0,7500000
1378,1378,Grand Polycoats Company Private Limited,U74999GJ1988PTC010350,74.0,572500
1379,1379,Grand Royale Enterprises Limited,U63040TN2004PLC052966,63.0,1400000
1380,1380,Grandhi Enterprises Private Limited,U67120KA1993PTC032115,66.0,5500000
1381,1381,Granules India Limited,L24110TG1991PLC012471,20.0,14004000
1382,1382,Gravita India Limited,L29308RJ1992PLC006870,27.0,360000
1383,1383,Gravitie Knowledge Services Private Limited,U27200DL2006PTC144901,,1235000
1384,1384,Grd Securities Limited,U67120WB1994PLC065927,,400000
1385,1385,Great Eastern Retail Private Limited,U63022WB1998PTC086420,,0
1386,1386,Great Galleon Ventures Limited,,,3000000
1387,1387,Great Software Laboratory Private Limited,U29100PN2003PTC018277,,2506000
1388,1388,Greatship (India ) Limited,U63090MH2002PLC136326,52.0,6800000
1389,1389,Green Infra Btv Limited,U40109DL2008PLC275062,,800000
1390,1390,Green Infra Solar Farms Limited,U40107DL2010PLC202168,40.0,1100000
1391,1391,Green Infra Wind Energy Limited,U23200DL2005PLC213430,23.0,1660438
1392,1392,Green Infra Wind Energy Project Limited,U40108DL2011PLC221875,,1100000
1393,1393,Greenesol Power Systems Private Limited,U40104TG2003PTC041169,,3600000
1394,1394,Greenlam Industries Limited,L21016AS2013PLC011624,21.0,5294000
1395,1395,Greenpark Hotels And Resorts Limited,U55101TG1986PLC006972,55.0,0
1396,1396,Greenply Industries Ltd,L20211AS1990PLC003484,16.0,2237000
1397,1397,Greenspan Agri-Tech Private Limited,U01113PN2003PTC018590,,630250
1398,1398,Greenstone Agro Product And Infrastructure Private Limited,U45102GJ2004PTC045119,,697733
1399,1399,Grey Worldwide (India) Private Limited,U74210MH1975PTC018529,74.0,314869
1400,1400,Gripwel Fasteners Private Limited,U29214DL2005PTC132107,29.0,2000000
1401,1401,Grm Overseas Limited (Ltd. Co. With Part  Ix),,,1200000
1402,1402,Gromax Agri Equipment Limited,,,536000
1403,1403,Group M Media India Private Limited,U74300MH2001PTC134079,73.0,7400000
