,Unnamed: 0,name,CIN,NIC,amount
2780,2780,Pioneer Investcorp Limited,L65990MH1984PLC031909,65.0,500000
2781,2781,Pioneer Polyleathers Limited,U17303DL2005PLC134427,17.0,0
2782,2782,Pioneer Urban Land & Infrastructure Limited,U65910DL1985PLC019985,64.0,1098929
2783,2783,Pipavav Railway Corporation Limited,U45200DL2000PLC151199,45.0,353977
2784,2784,Pipe Hangers & Supports Private Limited,U28991TN1984PTC011068,,1100000
2785,2785,Piramal Finance Limited,U99999MH1974PLC129493,,3800000
2786,2786,Pitti Laminations Limited,L29253TG1983PLC004141,29.0,2939000
2787,2787,Pix Transmissions Ltd,L25192MH1981PLC024837,25.0,508000
2788,2788,Planet Support Services India Private Limited,U92190MH1980PTC023561,,1000000
2789,2789,Plansee India High Performance Materials Private Limited,U27201KA1991PTC011566,,2500000
2790,2790,Plastiblends India Limited,L25200MH1991PLC059943,25.0,0
2791,2791,Pluto Software Private Limited,U72200DL2005PTC136437,,701900
2792,2792,Pn Memorial Neuro Centre & Research Institute Limited,U85110WB2000PLC091118,,2502198
2793,2793,Pnb Housing Finance Limited,U65922DL1988PLC033856,64.0,21771000
2794,2794,Pnb Metlife India Insurance Company Limited,U66010KA2001PLC028883,66.0,17625520
2795,2795,Poddar Housing And Development Limited,L51909MH1982PLC143066,51.0,2100000
2796,2796,Poddar Pigments Limited,L24117RJ1991PLC006307,20.0,4260000
2797,2797,Poddar Tyres Limited,U25100MH1981PLC023895,25.0,7825000
2798,2798,Pokarna Limited,L14102TG1991PLC013299,14.0,963000
2799,2799,Polaris Consulting & Services Limited,L65993TN1993PLC024142,65.0,0
2800,2800,Polybond (India) Pvt Ltd,U25199MH1983PTC030558,,3734000
2801,2801,Polydrug Laboratories Private Limited,U24231MH2004PTC147729,,1650000
2802,2802,Polyhydron Private Limited,U29120KA1989PTC010171,,1648200
2803,2803,Polyhydron Systems Private Limited,U31200KA1990PTC010883,,1169256
2804,2804,Polyplex Corporation Limited,L25209UR1984PLC011596,25.0,1600000
2805,2805,Pon Pure Chemical India Private Limited,U24111TN1998PTC040872,,1300000
2806,2806,Pooja Forge Limited,U27310DL1986PLC025557,,200000
2807,2807,Poompuhar Shipping Corpn Limited,U63090TN1974PLC006596,52.0,200000
2808,2808,Poona Shims Pvt Ltd,U29302PN1981PTC024033,,550000
2809,2809,Posco- India Pune Processing Center Private Limited,U27107PN2005PTC021580,,552157
2810,2810,Power Finance Corporation Limited,L65910DL1986GOI024862,64.0,0
2811,2811,Power Grid Corporation Of India Limited,L40101DL1989GOI038121,40.0,163805000
2812,2812,Power System Operation Corporation Limited,U40105DL2009GOI188682,40.0,10827711
2813,2813,Powerband Industries Private Limited,U24110DD2011PTC004695,,1827440
2814,2814,Powerica Limited,U31100MH1984PLC032825,31.0,1000000
2815,2815,Powerlinks Transmission Limited,U40105DL2001PLC110714,40.0,31225000
2816,2816,Powermaster Engineers Private Limited,U29305MH1971PTC015118,,24000
2817,2817,Ppn Power Generating Company Private Limited,U40101TN1994PTC027477,40.0,42200000
2818,2818,Prabha Engineering Private Limited,U29920MH1979PTC021202,,541000
2819,2819,Prabhat Agri Biotech Limited,U01112TG1992PLC014346,1.0,2516000
2820,2820,Prabhu International Vyapar Private Limited,U27109WB2004PTC097565,27.0,84000
2821,2821,Practice Strategic Communications India Private Limited,U74999KA2006PTC039572,74.0,800000
2822,2822,Pragati Automation Private Limited,U29199KA2001PTC029247,29.0,1000000
2823,2823,Pragya Equities Private Limited,U51420MH1995PTC085262,,50000
2824,2824,Praj Hipurity Systems Limited,U41000MH2007PLC175261,41.0,3104050
2825,2825,Prakash Asphaltings And Toll Highways (India) Limited,U45203MP1996PLC011034,,2300000
2826,2826,Prakash Gold Palace Private Limited,U36911TN1998PTC040659,,300000
2827,2827,Prakash Industries Limited,L27109HR1980PLC010724,27.0,225000
2828,2828,Prama Hikvision India Private Limited,U74990MH2009PTC190094,,2500000
2829,2829,Pramati Technologies Private Limited,U72200TG1998PTC029263,,0
2830,2830,Prasad Koch Technik Private Limited,U33301GJ1997PTC033151,,249000
2831,2831,Prasad Media Corporation Private Limited,U92199TG2001PTC036120,,0
2832,2832,Prasad Seeds Private Limited,U01122AP1994PTC018609,,0
2833,2833,Prashant Castech Private Limited,U27310GJ2009PTC056501,,1812000
2834,2834,Prasol Chemicals Limited,U99999MH1992PLC065026,,1000000
2835,2835,Prasuna Vamsikrishna Spinning Mills Private Limited,U18101AP2004PTC042636,,702200
2836,2836,Prataap Snacks Limited,U15311MP2009PLC021746,,2533000
2837,2837,Pratibha Syntex Limited,U17111MH1982PLC118017,17.0,1000000
2838,2838,Prayag Polytech Private Limited (Transfer From Delhi To Rajasthan),U28994RJ1982PTC012328,,790000
2839,2839,Prazim Trading And Investment Company Private Limited.,U65993KA1981PTC024196,65.0,2095000
2840,2840,Precia Molen India Private Limited,U29309TN1995PTC033931,,0
2841,2841,Precision Camshafts Limited,U24231PN1992PLC067126,,0
2842,2842,Prem Cables Pvt Ltd,U31300GJ1964PTC057316,,2300000
2843,2843,Premas Biotech Private Limited,U24232HR2005PTC035932,,500000
2844,2844,Premier Evolvics Private Limited,U02520TZ1981PTC001107,2.0,900000
2845,2845,Premier Explosives Limited,L24110TG1980PLC002633,20.0,100000
2846,2846,Premier Mills Private Limited,U17111TZ1994PTC005511,17.0,3400000
2847,2847,Premier Spg And Wvg Mills Private Limited,U17111TZ1945PTC000146,17.0,2000000
2848,2848,Premium Chick Feeds Private Limited,U15331MH1991PTC061966,,0
2849,2849,Prerana Motors Private Limited,U05040KA1999PTC024822,,0
2850,2850,Prescient Securities Private Limited,U65929MH2003PTC141455,,80000000
2851,2851,Pressmatic Engineers India Private Limited,U31900TZ2008PTC014347,31.0,1100000
2852,2852,Prestige Holiday Resorts Private Limited,U01122GA1993PTC002722,,1325000
2853,2853,Pricewaterhousecoopers Private Limited,U74140WB1983PTC036093,,0
2854,2854,Pricewaterhousecoopers Service Delivery Center (Kolkata) Private Limited,U72200WB2010PTC142115,,8550000
2855,2855,Pricol Limited,L33129TZ1972PLC000641,29.0,3300000
2856,2856,Pride And Expert Properties Private Limited,U85110KA1996PTC019850,,1140000
2857,2857,Pride Lifestyles Limited,U55101MH1999PLC122848,,5000000
2858,2858,Pridhvi Asset Reconstruction And Securitisation Company Limited,U67120TG2007PLC053327,67.0,4000000
2859,2859,Prima Products Private Limited,U17111TZ1987PTC001972,17.0,100000
2860,2860,Primal Projects Private Limited,U07010KA2000PTC027690,,60000000
2861,2861,Prince Gold And Diamonds India Private Limited,U36911TN2006PTC061041,36.0,1100000
2862,2862,Prince Pipes And Fittings Private Limited,U26932GA1987PTC006287,,1100000
2863,2863,Prince Swr Systems Private Limited,U25206MH1995PTC086960,,25000
2864,2864,Princeton Infrastructure Private Limited,U45201DL2005PTC135768,,4641123
2865,2865,Prism Enterprises Private Limited,U51100MH1999PTC118805,51.0,1110000
2866,2866,Pristine Developers Private Limited,U45200MH2005PTC152142,,700000
2867,2867,Priya Softweb Solutions Private Limited,U72200GJ2004PTC044670,,39900
2868,2868,Priyanka Finance Private Limited,U65191TN1989PTC016994,,510000
2869,2869,Proconnect Supply Chain Solutions Limited,U63030TN2012PLC087458,63.0,1200000
2870,2870,Procter & Gamble Hygiene And Health Care Limited,L24239MH1964PLC012971,21.0,0
2871,2871,Prodapt Solutions Private Limited,U30007TN1999PTC041798,30.0,1500000
2872,2872,Profab Engineers Private Limited,U31300MH1998PTC117239,,100000
2873,2873,Progressive Fertichem Private Limited,U24123AS2007PTC008317,,646031
2874,2874,Prokarma Softech Private Limited,U72200TG2004PTC043074,,4000000
2875,2875,Promac Engineering Industries Limited,U24210KA1972PLC002255,20.0,530430
2876,2876,Prometric Testing Private Limited Tfr. From Delhi To Haryana,U74899HR1997PTC036038,,1897204
2877,2877,Promont Hilltop Private Limited,U45209MH2012PTC236134,45.0,5040412
2878,2878,Property Ventures (India) Private Limited,U45200RJ2000PTC034234,,1600000
2879,2879,Prorigo Software Private Limited,U72900PN2008PTC132833,,80000
2880,2880,Provident Housing Limited,U45200KA2008PLC048273,45.0,278000
2881,2881,Provimi Animal Nutrition India Private Limited,U24111KA1983PTC005213,,9843988
2882,2882,Prudent Corporate Advisory Services Limited,U91120GJ2003PLC042458,,508000
2883,2883,Prudential Rubber Pvt Ltd,U25191KL1980PTC003164,25.0,723144
2884,2884,Pruksa India Housing Private Limited,U70102KA2009PTC048926,,500000
2885,2885,Psp Projects Limited,U45201GJ2008PLC054868,,1600000
2886,2886,Ptc Energy Limited,U40106DL2008PLC181648,40.0,411015
2887,2887,Ptc India Limited,L40105DL1999PLC099328,40.0,400000
2888,2888,Ptc Industries Limited,L27109UP1963PLC002931,27.0,2112915
2889,2889,Pubmatic India Private Limited,U93090PN2006PTC155503,,1428200
2890,2890,Puma Sports India Private Limited,U51909KA2005PTC037319,,3356950
2891,2891,Punch Ratna Fasteners Private Limited,U74899DL1994PTC060118,,870100
2892,2892,Purva Star Properties Private Limited,U45201KA2007PTC042489,45.0,0
2893,2893,Purvaja Projects Limited,U65990MH1993PLC070782,65.0,487000
2894,2894,Pushpak Steel Industries Private Limited,U27101MH1992PTC064801,,1300000
2895,2895,Pvp Ventures Limited,L72300TN1991PLC020122,63.0,3274000
2896,2896,Pyrotech Electronics Pvt. Ltd.,U40109RJ1988PTC011556,,0
2897,2897,Qed Agro Systems Private Limited,U01409KA2000PTC026862,1.0,1211350
2898,2898,Qrg Enterprises Limited.,U31900DL1991PLC043974,31.0,6368000
2899,2899,Qualcomm India Private Limited,U64202DL1996PTC076991,,45030000
2900,2900,Quality Care India Limited,U85110AP1992PLC014728,86.0,3400000
2901,2901,Quality Engineering And Software Technologies Private Limited,U72200KA1998PTC023481,,3675000
2902,2902,Quality Systems India Healthcare Private Limited,U85100KA2011FTC056781,,1500000
2903,2903,Quantum Knits Private Limited,U18101TZ2009PTC015251,18.0,700000
2904,2904,Qube Cinema Technologies Private Limited,,,7600000
2905,2905,Quest Global Engineering Private Limited,U72200KA2008PTC047200,,3861066
2906,2906,Quest Global Engineering Services Private Limited,U74900KA2014PTC076219,,1100000
2907,2907,Quintiles Research (India) Private Limited,U73100GJ2002PTC074076,,4500000
2908,2908,Quislex Legal Services Private Limited,U74110TG2004PTC043620,,301526
2909,2909,R B A Exports Pvt. Ltd.,U27109WB1989PTC047383,,839300
2910,2910,R E-Rogers India Private Limited,U74899DL1986PTC024177,,0
2911,2911,R G Bronze Mfg Company Private Limited,U29309TN1996PTC035049,,300000
2912,2912,R S B Cottex Limited,U17121GJ2011PLC068231,,312000
2913,2913,R S Technologies Private Limited,U30007DL1998PTC093644,,1083571
2914,2914,R Systems International Limited,L74899DL1993PLC053579,74.0,1500000
2915,2915,R. L. Jewels Private Limited,U36911MH2007PTC176844,36.0,0
2916,2916,R.A.K.Ceramics India Private Limited,U26919TG2004PTC042401,26.0,1300000
2917,2917,R.K. Infracorp Private Limited,U45200AP2008PTC059199,,0
2918,2918,R.K. Marble Private Limited,U14101RJ1989PTC004974,,30200000
2919,2919,R.K.Swamy Bbdo Private Limited,U74300TN1973PTC006304,73.0,1100000
2920,2920,R.P.P Infra Projects Limited,L45201TZ1995PLC006113,45.0,1000000
2921,2921,R.V. Investment And Dealers Ltd,U65993WB1972PLC028595,65.0,1300000
2922,2922,R1 Rcm Global Private Limited,,,1492450
2923,2923,Ra Chem Pharma Limited,U24110TG1996PLC022816,,1101135
2924,2924,Raajratna Metal Industries Ltd,U24231GJ1988PLC010673,21.0,200000
2925,2925,Rabo India Finance Limited,U65929HR1998PLC037509,64.0,3299452
2926,2926,Radha Soami Food Products Private Limited,U15311RJ1995PTC009786,,675938
2927,2927,Radhamani Exports Private Limited,U51109WB1996PTC077135,,1150000
2928,2928,Radhamani Textiles Private Limited,U17120WB2008PTC122043,,2412500
2929,2929,Radico Khaitan Limited,L26941UP1983PLC027278,23.0,7106770
2930,2930,Radico Nv Distilleries Maharashtra Limited,U15429MH2000PLC193208,10.0,8808000
2931,2931,Radisys India Private Limited,U72200KA2004PTC033252,,2992500
2932,2932,Raghu Trading And Investment Company Private Limited,U74899DL1974PTC007150,,700000
2933,2933,Raheja Developers Limited,U45400DL1990PLC042200,45.0,1800000
2934,2934,Raheja Universal (Pvt) Limited,U45200MH1980PTC023430,,200000
2935,2935,Railtech Infraventure Private Limited,U29253DL2008PTC176289,,7405000
2936,2936,Railtel Corporation Of India Limited,U64202DL2000GOI107905,,10300000
2937,2937,Rain Cii Carbon (Vizag) Limited,U11100TG2008PLC058785,11.0,930000
2938,2938,Raipur Coal Feeder Private Limited,U10100CT2000PTC014130,,300000
2939,2939,Raj Process Equipments And Systems Private Limited,U29299PN2003PTC017672,,805700
2940,2940,Raj Television Network Limited,L92490TN1994PLC027709,92.0,0
2941,2941,Raj Westpower Ltd,U31102MH1996PLC185098,31.0,51951284
2942,2942,Rajam Enterprises Private Limited,U67120KA1995PTC033571,66.0,5500000
2943,2943,Rajapalayam Mills Limited,L17111TN1936PLC002298,17.0,15300000
2944,2944,Rajarhat It Park Limited,U70101DL2009PLC191541,70.0,300000
2945,2945,Rajasthan Electronics And Instruments Ltd,U51395RJ1981GOI002249,51.0,692020
2946,2946,Rajasthan Global Securities Private Limited,U67120DL1995PTC072778,,11000000
2947,2947,Rajasthan Gum Private Limited,U24139RJ1998PTC015012,,26430000
2948,2948,Rajasthan Knowledge Corporation Limited,U80302RJ2008PLC026433,80.0,7905260
2949,2949,Rajasthan Rajya Vidyut Prasaran Nigam Limited,U40109RJ2000SGC016485,40.0,814000
2950,2950,Rajasthan Rajya Vidyut Utpadan Nigam Limited,U40102RJ2000SGC016484,40.0,50800000
2951,2951,Rajasthan State Beverages Corporation Limited,U15511RJ2005SGC020336,15.0,500000
2952,2952,Rajasthan State Industrial Development And Investment Corporation Ltd,U13100RJ1969SGC001263,13.0,28194000
2953,2953,Rajasthan State Mines And Minerals Ltd,U14109RJ1949SGC000505,14.0,21418028
2954,2954,Rajasthan State Road Development And Construction Corporation Limited,U45203RJ1979SGC001853,45.0,200000
2955,2955,Rajasthan Sun Technique Energy Private Limited,U74990MH2009PTC195625,,470000
2956,2956,Rajesh Projects (India) Private Limited,U45201DL1999PTC101984,,2100000
2957,2957,Rajhans Infracon (India) Private Limited,U70102GJ2010PTC059951,,232050
2958,2958,Rajkamal Builders Infrastructure Private  Limited,,,2000000
2959,2959,Rajlaxmi Construction Limited,U45202OR1993PLC003328,,500000
2960,2960,Rajlaxmi Griha Nirman Private Limited,U45201WB2005PTC102967,,0
2961,2961,Rajmahal Coal Mining Limited,U10300WB2012PLC181325,10.0,118977
2962,2962,Rajmal Lakhichand Jewelers Private Limited,U24230MH1997PTC110243,21.0,0
2963,2963,Rajoo Engineers Limited,L27100GJ1986PLC009212,27.0,110000
2964,2964,Ralson (India) Limited,U51909DL1974PLC042836,51.0,4281159
2965,2965,Ram Kripal Singh Construction Private Limited,U45200BR2003PTC010375,,3024993
2966,2966,Ram Ratna Wires Limited,L31300MH1992PLC067802,31.0,609000
2967,2967,Rama Phosphates Limited,L24110MH1984PLC033917,20.0,30000
2968,2968,Ramabhadra Industries Private Limited,U28110AP1974PTC001739,,0
2969,2969,Rambagh Palace Hotel Private Limited,U55101RJ1972PTC001445,55.0,2400000
2970,2970,Rambus Chip Technologies (India) Private Limited,U30007KA2004PTC034991,,1122108
2971,2971,Ramco Industries Limited,L26943TN1965PLC005297,23.0,1183000
2972,2972,Ramco Steels Private Limited,U74899DL1992PTC048248,,1100000
2973,2973,Ramdev Food Products Private Limited,U15499GJ1989PTC011740,,1000000
2974,2974,Ramgad Minerals And Mining Limited,U27101KA1978PLC003360,27.0,10000000
2975,2975,Ramkrishy Infrastructure Private Limited,U45203KA2008PTC045706,,1200000
2976,2976,Ramkumar Morarka And Sons Private Limited,U99999MH1946PTC004824,99.0,205000
2977,2977,Ramky Enviro Engineers Limited,U74140TG1994PLC018833,74.0,989897
2978,2978,Ramprastha Promoters And Developers Priv Ate Limited,U45400HR2007PTC064534,,1986923
2979,2979,Rane Holdings Limited,L35999TN1936PLC002202,35.0,1000000
2980,2980,Rane Trw Steering Systems Private Limited,U35999TN1987PTC014600,,7600000
2981,2981,Ranger Apparel Export Private Limited,U01810KA1996PTC020584,,2000000
2982,2982,Rangoli Portfolio Private Limited,U67120HR2007PTC036613,,100000
2983,2983,Raptim Research Limited,U73100MH2002PLC136230,,811684
2984,2984,Rare Rose Premises Private Limited,U65993MH2001PTC130789,65.0,78894
2985,2985,Rashi Peripherals Private Limited,U30007MH1989PTC051039,30.0,1000000
2986,2986,Rashtriya Chemicals And Fertilizers Limited,L24110MH1978GOI020185,20.0,3490000
2987,2987,Rashtriya Ispat Nigam Ltd,U27109AP1982GOI003404,27.0,23256000
2988,2988,Rasi Seeds Private Limited,U01112TZ1986PTC001864,,2600000
2989,2989,Rasi Tex India Private Limited,U17111TN1996PTC056836,,2600000
2990,2990,Ratan Housing Development Limited,U17117UP1998PLC023288,,6700000
2991,2991,Ratilal Bhagwandas Construction Company P Ltd,U70101MH1990PTC059577,,1189100
2992,2992,Ratna Commercial Enterprises Private Ltd.,U74899DL1979PTC021610,74.0,2275000
2993,2993,Ratna Sagar Private Limited,U74899DL1986PTC023532,,200000
2994,2994,Ratnadeep Super Market Private Limited,U51399TG1995PTC019385,,0
2995,2995,Ratnakala Exports Private Limited,U40300MH2009PTC192936,,0
2996,2996,Ratnamani Metals And Tubes Limited,L70109GJ1983PLC006460,68.0,3762006
2997,2997,Ravi Infrabuild Projects Private Limited,U45201RJ2009PTC028378,,1600000
2998,2998,Ravindra Heraeus Private Limited,U36911RJ1988PTC004669,,100000
2999,2999,Rba Properties Limited,U45201WB2001PLC092763,45.0,3000000
3000,3000,Rbl Bank Limited,U65191PN1943PLC007308,64.0,4081000
3001,3001,Rbs Financial Services (India) Private Limited,U67120MH1997PTC112574,,2266100
3002,3002,Rci India Private Limited,U29246KA1995PTC017334,,4200000
3003,3003,Rdb Rasayans Ltd.,L36999WB1995PLC074860,36.0,900000
3004,3004,Rds Project Limited,U51909DL1992PLC049570,,100000
3005,3005,Real Ispat And Power Limited,U27107CT1999PLC013773,,3100000
3006,3006,Real Technical Solutions Private Limited,U74900MH2008PTC180911,,68963
3007,3007,Rec Engineering Products Private Limited,U29150KA2005PTC036234,,350000
3008,3008,Rec Transmission Projects Company Limited,U40101DL2007GOI157558,40.0,0
3009,3009,Red Earth Good Living And Hospitalityprivate Limited,U55100KA2004PTC034447,,400000
3010,3010,Refex Energy Limited,U40100TN2008PLC067360,,300000
3011,3011,Regal Vacation Concepts Private Limited,U55101GA2000PTC002931,,1500000
3012,3012,Regency Nirman Limited,U45200MH2005PLC153966,,575000
3013,3013,Regent Beers And Wines Limited,U15531MP1997PLC012356,,0
3014,3014,Regent Electro-Mech Private Limited,U31901WB2000PTC090914,,1000000
3015,3015,Rehau Polymers Private Limited,U74999PN1997PTC133903,,0
3016,3016,Reliance Capital Ltd,L65910MH1986PLC165645,64.0,98300000
3017,3017,Reliance General Insurance Company Limited,U66603MH2000PLC128300,66.0,3514000
3018,3018,Reliance Home Finance Limited,U67190MH2008PLC183216,67.0,13300000
3019,3019,Reliance Industries Holding Private Limited,U51103MH2007PTC168016,,540000
3020,3020,Reliance Industries Limited,L17110MH1973PLC019786,17.0,1281000000
3021,3021,Reliance Infrastructure Limited,L99999MH1929PLC001530,99.0,321700000
3022,3022,Reliance Power Limited,L40101MH1995PLC084687,40.0,40200000
3023,3023,Reliance Retail Limited,U01100MH1999PLC120563,1.0,32500000
3024,3024,Religare Enterprises Limited,L74899DL1984PLC146935,74.0,498842
3025,3025,Religare Finvest Limited,U74999DL1995PLC064132,74.0,18088432
3026,3026,Renaissance Asset Management Company Private Limited,U74899DL2000PTC107953,74.0,100000
3027,3027,Renault Nissan Technology & Business Centre India Private Limited,U50401TN2007PTC064840,50.0,15300000
3028,3028,Renew Wind Energy (Karnataka) Private Limited,U40109DL2012PTC235990,40.0,2600000
3029,3029,Renfro India Private Limited,U17118PN1995PTC018285,17.0,50000
3030,3030,Renold Chain India Private Limited,U27109TZ2008FTC017737,27.0,0
3031,3031,Repco Micro Finance Limited,U74900TN2007PLC064126,74.0,300000
3032,3032,Replicon Software (India) Private Limited,U72200KA2006PTC039898,,200000
3033,3033,Reservation Data Maintainence (India) Private Limited,U74899DL1992PTC049530,,4873790
3034,3034,Resin Distributors Limited,U29246MH2001PLC133375,29.0,1600000
3035,3035,Results Marine Private Limited,U63032TN2004PTC052624,63.0,800000
3036,3036,Rgvn (North East) Microfinance Limited,U65923AS2008PLC008742,65.0,2915816
3037,3037,Rhi Clasil Private Limited,U26914TG2005PTC048333,,563415
3038,3038,Rhine Power Private Limited,U74899DL1995PTC072283,,0
3039,3039,Ricela Health Foods Limited,U15142PB1992PLC012726,10.0,100000
3040,3040,Richa Fashion Private Limited,U18109DL2011PTC215570,,0
3041,3041,Ridaan And Ruhan Buildwell Private Limited,U70102DL2004PTC124081,,30000
3042,3042,Riddhi Siddhi Developers Pvt Ltd,U45200MH1987PTC042505,,18851000
3043,3043,Right Tight Fastners Private Limited,U28991MH1979PTC021250,,0
3044,3044,Rim Jhim Ispat Limted,U27101UP1991PLC012679,27.0,1000000
3045,3045,Rishi Fibc Solutions Private Limited,U25209GJ2007PTC049943,,7575056
3046,3046,Rishi Kiran Logistics Private Limited,U61100GJ1995PTC027875,,1947476
3047,3047,Rites Limited,U74899DL1974GOI007227,74.0,49000000
3048,3048,River Engineering Private Limited,U74140DL2007PTC166854,74.0,250000
3049,3049,Riviera Home Furnishings Private Limited,U74899DL1995PTC067065,,5700000
3050,3050,Rjp Infrastructure Private Limited,U45201GJ1993PTC020933,,226711
3051,3051,Rkc Infrabuilt Private Limited,U45200GJ2011PTC067196,,0
3052,3052,Rmc Gems India Limited,U36911RJ2001PLC016870,32.0,1620000
3053,3053,Rmsi Private Limited,U74899DL1992PTC047149,,100000
3054,3054,Rnt Plantations Limited,U70109WB1981PLC033406,68.0,1300000
3055,3055,Robert Bosch Engineering And Business Solutions Private Limited,U72400KA1997PTC023164,,23000000
3056,3056,Roca Bathroom Products Private Limited,U15421TN1983PTC010243,10.0,8028000
3057,3057,Rockwell Collins (India) Enterprises Private Limited,U72200TG2007PTC056315,,1300000
3058,3058,Rodic Consultants Private Limited,U40300BR2000PTC009328,,300000
3059,3059,Roger Industries Limited,U19129UP2007PLC034134,,832894
3060,3060,Roha Dye Chem Private Limited,U40300MH1972PTC015941,,23600000
3061,3061,Rohan Builders (India) Private Limited,U45201PN1994PTC077758,,1890550
3062,3062,Rohan Builders And Developers Private Limited,U45202PN2001PTC016352,45.0,400000
3063,3063,Rohini Minerals Private Limited,U15209TG1999PTC032819,,0
3064,3064,Rohit Iron And Steel (India) Private Limited,U27100MH2004PTC146303,,10000000
3065,3065,Rolex Rings Private Limited,U28910GJ2003PTC041991,25.0,0
3066,3066,Rollatainers Limited,L21014HR1968PLC004844,17.0,0
3067,3067,Rolta India Limited,L74999MH1989PLC052384,74.0,0
3068,3068,Roman Catholic Diocess Of Agra Private Limited,U22121UP1932PTC000460,,959215
3069,3069,Romsons Scientific And Surgical Industries Private Limited,U24236UP1977PTC004511,,800000
3070,3070,Ronak Optik India Private Limited,U74900WB2009PTC135063,,802580
3071,3071,Ronuplate Private Limited.,U24242MH1996PTC163989,,1026675
3072,3072,Roots Auto Products Private Limited,U34300TZ1984PTC001458,29.0,100000
3073,3073,Roots Industries India Limited,U02520TZ1990PLC002987,2.0,1400000
3074,3074,Rosa Power Supply Company Limited,U31101MH1994PLC243148,31.0,183700000
3075,3075,Rosenberger Electronic Company (India)Private Limited,U32109DL2006PTC146129,,100000
3076,3076,Rossell India Limited,L01132WB1994PLC063513,1.0,2221000
3077,3077,Rotex Automation Limited,U29259GJ1983PLC005831,,0
3078,3078,Rotex Manufacturers And Engineers Private Limited,U15008MH1971PTC015008,,2075000
3079,3079,Rothe Erde India Private Limited,U27109MH2006PTC161325,27.0,3569000
3080,3080,Roto Pumps Limited,L28991UP1975PLC004152,28.0,0
3081,3081,Rotork Controls (India) Private Limited,U28990TN1979PTC007891,,1010000
3082,3082,Royal Beverages Private Limited,U15511PB2007PTC031187,,16800000
3083,3083,Royal Distillery Private Limited,U15511DD1986PTC000674,,151000
3084,3084,Royal Infraengineering Private Limited,U45201GJ2009PTC055964,,0
3085,3085,Royal Sundaram General Insurance Co. Limited,U67200TN2000PLC045611,67.0,8200000
3086,3086,Royal Touch Fablon Private Limited,U19202WB1999PTC090687,15.0,179494
3087,3087,Rrhl Realty Limited,U45207MH2007PLC173442,45.0,0
3088,3088,Rsh Global Private Limited,U24246WB2005PTC103808,,1150000
3089,3089,Rsm Autokast Limited,U02899TZ1996PLC006844,,500000
3090,3090,Rsm Builders & Securities Private Limited,U45200WB1987PTC042478,45.0,1100000
3091,3091,Rsm Estates Limited,U45201WB2001PLC092766,45.0,2000000
3092,3092,Rsp Design Consultants (India) Private Limited,U85110KA1996PTC019807,86.0,0
3093,3093,Rswm Limited,L17115RJ1960PLC008216,17.0,335000
3094,3094,Ruchi Global Limited,U51500MH1996PLC099082,51.0,430000
3095,3095,Ruchi Soya Industries Limited,L15140MH1986PLC038536,10.0,2184000
3096,3096,Rudolf Atul Chemicals Limited,U24110GJ2005PLC045564,24.0,650000
3097,3097,Rudrabhishek Enterprises Private Limited,U74899DL1992PTC050142,,3200000
3098,3098,Rungta Mines Limited,U26911WB1962PLC025691,26.0,6034948
3099,3099,Rungta Sons Pvt Ltd,U02005WB1943PTC011231,2.0,1505000
3100,3100,Runner Marketing Private Limited,U51109DL1996PTC195897,,200000
3101,3101,Rural Electrification Corporation Limited,L40101DL1969GOI005095,40.0,1294732031
3102,3102,Rusan Pharma Limited,U24230MH1994PLC077069,,2000000
3103,3103,Rushil Decor Limited,L25209GJ1993PLC019532,25.0,154000
3104,3104,S & P Feeds Private Limited,,,2800000
3105,3105,S H Kelkar And Company Limited,U74999MH1955PLC009593,74.0,5200000
3106,3106,S K M Animal Feeds And Foods (India) Private Limited,U01533TZ1981PTC001076,,3200000
3107,3107,S Kant Healthcare Limited,U24230MH1996PLC098246,21.0,2100000
3108,3108,S M L Finance Limited,U65910KL1996PLC010648,64.0,144140
3109,3109,S S A International Ltd,U15122DL1995PLC068186,,1740460
3110,3110,S.B. Reshellers Private Limited,U29199MH1949PTC007210,29.0,2005000
3111,3111,S.G.P.Exim Private Limited,U52321TN1992PTC022428,,61500000
3112,3112,S.J.S. Enterprises Private Limited,U51909KA2005PTC036601,51.0,3800000
3113,3113,S.M.I.L.E. Microfinance Limited,U67190TN1995PLC030604,,3300000
3114,3114,S.P.Y. Agro Industries Limited,U01100TG2005PLC045887,,600000
3115,3115,Saama Technologies (India) Private Limited,U72200PN1999PTC139628,,1000000
3116,3116,Sabic Research And Technology Private Limited,U17119KA1998PTC080762,,3286080
3117,3117,Sable Waghire And Co Private Limited,U16003MH1966PTC013636,,0
3118,3118,Sac Engine Components Private Limited,U27104TN1991PTC021637,,0
3119,3119,Sadbhav Engineering Limited,L45400GJ1988PLC011322,45.0,4600000
